businessId,imageUploaderId,imageUrl,imageUploadDate,imageComment,helpfulCount,reported
66,50,http://lorempixel.com/640/480/food,Fri Nov 08 2013 21:01:53 GMT-0800 (PST),Itaque magnam expedita qui reprehenderit odio ea temporibus enim quo.,36,false
14,8,http://lorempixel.com/640/480/food,Fri Dec 23 2016 22:53:31 GMT-0800 (PST),Odit aut praesentium occaecati et voluptatibus voluptatem est quia voluptatem.,40,false
34,41,http://lorempixel.com/640/480/food,Mon Dec 23 2013 02:04:08 GMT-0800 (PST),Tempore voluptatem ipsam vel qui repellendus dolorem autem dolorum dolore.,37,false
35,28,http://lorempixel.com/640/480/food,Fri Sep 13 2013 12:49:54 GMT-0700 (PDT),Qui qui voluptatem aut ut laboriosam praesentium rem et molestiae.,33,false
61,18,http://lorempixel.com/640/480/food,Fri Nov 27 2015 17:48:48 GMT-0800 (PST),Cum unde aperiam quaerat aliquam fuga dolore ea libero sequi.,39,false
7,37,http://lorempixel.com/640/480/food,Mon Apr 30 2018 06:56:54 GMT-0700 (PDT),Quia enim quibusdam modi et odio aut odit ut qui.,44,false
72,17,http://lorempixel.com/640/480/food,Wed May 07 2014 19:12:53 GMT-0700 (PDT),Quaerat et placeat eum explicabo officia fugiat qui fuga ipsam.,10,false
71,16,http://lorempixel.com/640/480/food,Mon Jun 16 2014 13:40:14 GMT-0700 (PDT),Fugiat quidem soluta ea autem voluptate qui inventore mollitia doloremque.,39,false
12,38,http://lorempixel.com/640/480/food,Fri Sep 01 2017 19:22:42 GMT-0700 (PDT),Ad sapiente recusandae provident consequatur nihil libero ut minus rerum.,9,false
65,42,http://lorempixel.com/640/480/food,Mon Mar 23 2015 17:33:28 GMT-0700 (PDT),Ab sit eius iusto vel voluptatum aut modi voluptate et.,25,false
79,1,http://lorempixel.com/640/480/food,Wed Oct 14 2015 07:25:26 GMT-0700 (PDT),Ut doloremque ullam tempora sed iste qui officia dolor cum.,26,false
58,45,http://lorempixel.com/640/480/food,Thu Nov 03 2016 22:03:19 GMT-0700 (PDT),Et rerum et voluptas sed praesentium ut vero accusantium tempore.,12,false
91,31,http://lorempixel.com/640/480/food,Wed Jun 29 2016 01:23:10 GMT-0700 (PDT),Ducimus corrupti illum voluptates natus sunt sit fugiat nihil in.,31,false
85,21,http://lorempixel.com/640/480/food,Mon Mar 24 2014 21:14:04 GMT-0700 (PDT),Odit similique fugiat harum necessitatibus cum quia quis ipsum error.,24,false
47,29,http://lorempixel.com/640/480/food,Fri Mar 17 2017 22:24:23 GMT-0700 (PDT),Voluptas voluptatem eaque sapiente dolor repudiandae perspiciatis tempora illo harum.,49,false
27,40,http://lorempixel.com/640/480/food,Sun Dec 18 2016 21:39:35 GMT-0800 (PST),Rerum aut dicta consequatur corrupti ea nobis quia dolorum ullam.,18,false
58,34,http://lorempixel.com/640/480/food,Tue Sep 23 2014 11:35:49 GMT-0700 (PDT),Minima ullam natus minus et pariatur dolor sint blanditiis omnis.,47,false
3,40,http://lorempixel.com/640/480/food,Thu Jan 26 2017 14:13:32 GMT-0800 (PST),Illum quis vero sint ipsum nisi dolorem sit id ea.,33,false
26,18,http://lorempixel.com/640/480/food,Sun Apr 24 2016 18:55:59 GMT-0700 (PDT),Inventore fuga reiciendis quisquam sit dolorum saepe provident provident est.,29,false
31,13,http://lorempixel.com/640/480/food,Wed Jan 07 2015 08:37:46 GMT-0800 (PST),Illo voluptatem laudantium nostrum asperiores molestiae sint quo in architecto.,48,false
90,29,http://lorempixel.com/640/480/food,Sat Aug 26 2017 03:59:45 GMT-0700 (PDT),Vel est voluptates aut dolores quisquam nulla quia eum rerum.,6,false
25,8,http://lorempixel.com/640/480/food,Sat Jan 07 2017 09:56:53 GMT-0800 (PST),Incidunt saepe sapiente autem nihil totam velit perspiciatis provident eum.,25,false
46,47,http://lorempixel.com/640/480/food,Thu Dec 03 2015 21:47:22 GMT-0800 (PST),Aut voluptatibus necessitatibus non voluptatem non quo animi nobis deleniti.,12,false
59,16,http://lorempixel.com/640/480/food,Mon Mar 03 2014 14:57:56 GMT-0800 (PST),Placeat neque deleniti non minima distinctio quod aspernatur cum eum.,50,false
34,25,http://lorempixel.com/640/480/food,Sat May 17 2014 00:04:06 GMT-0700 (PDT),Quos ab est aliquid et ea aut modi sapiente sunt.,20,false
8,39,http://lorempixel.com/640/480/food,Sat Aug 06 2016 12:16:15 GMT-0700 (PDT),Dolores ex eveniet quisquam aliquam facilis dolorem accusantium quam maxime.,23,false
13,11,http://lorempixel.com/640/480/food,Thu Sep 10 2015 09:46:39 GMT-0700 (PDT),Sapiente et assumenda labore omnis cupiditate architecto molestiae est unde.,49,false
48,40,http://lorempixel.com/640/480/food,Wed May 04 2016 19:12:29 GMT-0700 (PDT),Quia aut iusto ut delectus explicabo ut dignissimos corporis a.,30,false
70,44,http://lorempixel.com/640/480/food,Fri Jan 13 2017 19:53:17 GMT-0800 (PST),Nisi minima consectetur similique optio quam eveniet facere ad quo.,13,false
11,18,http://lorempixel.com/640/480/food,Tue Jul 08 2014 20:48:49 GMT-0700 (PDT),Nisi dignissimos animi aspernatur eos atque vero qui repellat nihil.,14,false
82,3,http://lorempixel.com/640/480/food,Sun Oct 11 2015 01:01:58 GMT-0700 (PDT),Neque consequatur nihil voluptate ut quo repudiandae veniam alias commodi.,46,false
39,48,http://lorempixel.com/640/480/food,Sat Apr 15 2017 08:44:37 GMT-0700 (PDT),Eum accusamus culpa labore iure voluptas ut reiciendis deleniti assumenda.,41,false
97,22,http://lorempixel.com/640/480/food,Tue Jan 24 2017 08:45:45 GMT-0800 (PST),Molestias eveniet debitis officia itaque necessitatibus aperiam maxime quia assumenda.,41,false
56,28,http://lorempixel.com/640/480/food,Tue Dec 03 2013 12:19:42 GMT-0800 (PST),Velit numquam blanditiis corporis ipsam est enim porro quae qui.,2,false
61,37,http://lorempixel.com/640/480/food,Fri Nov 01 2013 00:07:46 GMT-0700 (PDT),Qui magnam quae quod earum harum eveniet aut reiciendis omnis.,50,false
48,2,http://lorempixel.com/640/480/food,Mon Sep 18 2017 02:37:20 GMT-0700 (PDT),Voluptatem quia ea commodi consequatur quae ab ut sint placeat.,42,false
8,16,http://lorempixel.com/640/480/food,Tue Sep 23 2014 11:01:02 GMT-0700 (PDT),Aut qui voluptatem est alias modi sint optio consequatur officia.,8,false
8,43,http://lorempixel.com/640/480/food,Sun Jul 26 2015 18:32:44 GMT-0700 (PDT),Corrupti veritatis maxime labore autem officiis non sed ipsa sed.,21,false
92,23,http://lorempixel.com/640/480/food,Tue Aug 12 2014 14:38:23 GMT-0700 (PDT),Corrupti vitae voluptatem architecto nam perferendis praesentium illum architecto sapiente.,5,false
62,46,http://lorempixel.com/640/480/food,Sun Mar 19 2017 22:56:00 GMT-0700 (PDT),Quia quo nisi praesentium saepe tenetur animi ad quia numquam.,3,false
13,39,http://lorempixel.com/640/480/food,Thu Nov 13 2014 14:20:37 GMT-0800 (PST),Expedita beatae aliquid repudiandae doloremque recusandae sed totam aliquid est.,12,false
92,35,http://lorempixel.com/640/480/food,Fri Aug 25 2017 02:51:06 GMT-0700 (PDT),Eos et eveniet eos corrupti animi a voluptatum debitis id.,14,false
73,44,http://lorempixel.com/640/480/food,Sat Sep 24 2016 06:08:10 GMT-0700 (PDT),Accusamus iure recusandae non adipisci quis rem atque vitae quidem.,33,false
6,6,http://lorempixel.com/640/480/food,Mon Jan 06 2014 05:34:54 GMT-0800 (PST),Adipisci necessitatibus quod dolorum eius sint accusantium voluptas voluptatem nam.,12,false
45,26,http://lorempixel.com/640/480/food,Sat Nov 23 2013 02:37:33 GMT-0800 (PST),Hic qui dolor enim id et qui enim porro hic.,32,false
65,12,http://lorempixel.com/640/480/food,Tue Sep 20 2016 10:48:06 GMT-0700 (PDT),Beatae adipisci aliquid officiis quibusdam voluptates eum repellendus et totam.,14,false
98,39,http://lorempixel.com/640/480/food,Mon Jul 24 2017 06:01:27 GMT-0700 (PDT),Saepe velit voluptatum officiis atque et natus quod voluptates ut.,43,false
74,38,http://lorempixel.com/640/480/food,Sun Jul 05 2015 10:23:51 GMT-0700 (PDT),Facere nulla sit reprehenderit hic officiis nulla excepturi ducimus aut.,18,false
72,39,http://lorempixel.com/640/480/food,Mon Sep 15 2014 16:01:31 GMT-0700 (PDT),Et velit saepe quam sunt nihil nobis est ut provident.,37,false
62,42,http://lorempixel.com/640/480/food,Thu Apr 06 2017 10:44:13 GMT-0700 (PDT),Excepturi animi culpa aut modi quibusdam eos qui perspiciatis dolor.,26,false
53,6,http://lorempixel.com/640/480/food,Thu Sep 06 2018 22:15:29 GMT-0700 (PDT),Et minima sed earum ducimus et perspiciatis aut sed cumque.,23,false
96,36,http://lorempixel.com/640/480/food,Sun Apr 17 2016 18:56:01 GMT-0700 (PDT),Nihil temporibus magnam tempora nam voluptatem blanditiis facilis dolores non.,14,false
20,37,http://lorempixel.com/640/480/food,Thu Jul 20 2017 14:51:53 GMT-0700 (PDT),Dicta et consequatur aut esse sed necessitatibus ut asperiores et.,6,false
9,6,http://lorempixel.com/640/480/food,Thu Feb 09 2017 10:38:44 GMT-0800 (PST),Dolorem repellendus rerum illum quaerat impedit quia odit vitae quo.,6,false
12,13,http://lorempixel.com/640/480/food,Sun May 24 2015 01:25:04 GMT-0700 (PDT),Dolorem error omnis possimus non hic ut ea necessitatibus qui.,34,false
40,7,http://lorempixel.com/640/480/food,Tue May 29 2018 19:42:11 GMT-0700 (PDT),Tenetur facere inventore iure sunt ut autem ut odio voluptatem.,45,false
1,19,http://lorempixel.com/640/480/food,Sat Jul 05 2014 11:20:14 GMT-0700 (PDT),Necessitatibus impedit est rem quidem dolorem earum nostrum est quos.,50,false
72,42,http://lorempixel.com/640/480/food,Tue Oct 17 2017 04:31:14 GMT-0700 (PDT),Nisi fugit quas possimus ex iure modi deserunt et harum.,8,false
9,25,http://lorempixel.com/640/480/food,Fri Jul 29 2016 22:07:52 GMT-0700 (PDT),Voluptates quia facilis est optio consequatur cum autem enim qui.,40,false
7,25,http://lorempixel.com/640/480/food,Fri Mar 18 2016 21:17:42 GMT-0700 (PDT),Ut id placeat incidunt vel recusandae optio animi ut deleniti.,14,false
27,10,http://lorempixel.com/640/480/food,Sun Jul 26 2015 20:28:08 GMT-0700 (PDT),Dolor odio delectus in in soluta ab voluptate eius ea.,21,false
14,25,http://lorempixel.com/640/480/food,Sun Feb 05 2017 16:45:02 GMT-0800 (PST),Qui est quas ullam ut non error et velit deleniti.,6,false
70,17,http://lorempixel.com/640/480/food,Sat Jun 25 2016 06:22:29 GMT-0700 (PDT),Itaque sed harum perferendis enim sed minus error incidunt hic.,42,false
76,10,http://lorempixel.com/640/480/food,Fri Mar 25 2016 18:25:22 GMT-0700 (PDT),Laudantium occaecati placeat aspernatur sequi distinctio molestiae ullam quos dolor.,6,false
28,3,http://lorempixel.com/640/480/food,Mon Dec 26 2016 04:01:42 GMT-0800 (PST),Voluptates quidem veritatis qui sed ipsa facere alias at voluptatem.,9,false
32,7,http://lorempixel.com/640/480/food,Sat Jan 27 2018 02:00:18 GMT-0800 (PST),Et iste laboriosam veritatis delectus amet sed harum consequatur maxime.,37,false
66,43,http://lorempixel.com/640/480/food,Thu Sep 17 2015 21:04:42 GMT-0700 (PDT),Omnis reiciendis excepturi illo hic ut deleniti sint ullam alias.,36,false
72,30,http://lorempixel.com/640/480/food,Fri Jun 29 2018 17:00:15 GMT-0700 (PDT),Saepe sit facere laboriosam autem voluptatem tenetur modi odit magni.,28,false
6,12,http://lorempixel.com/640/480/food,Sat Dec 12 2015 02:28:25 GMT-0800 (PST),Qui cumque labore est voluptatem autem aspernatur sed recusandae est.,45,false
38,8,http://lorempixel.com/640/480/food,Tue Apr 12 2016 01:24:26 GMT-0700 (PDT),Est ea temporibus unde fuga qui porro molestias sint sint.,22,false
91,20,http://lorempixel.com/640/480/food,Fri Apr 22 2016 09:26:22 GMT-0700 (PDT),Sint sint consequatur illo veritatis rerum iure mollitia culpa ipsa.,33,false
82,11,http://lorempixel.com/640/480/food,Tue Sep 27 2016 20:17:22 GMT-0700 (PDT),Est sunt vitae quaerat qui ratione et illo possimus sit.,33,false
2,3,http://lorempixel.com/640/480/food,Sun Sep 25 2016 03:03:54 GMT-0700 (PDT),Dicta ea sed quis molestiae nulla ab non ut numquam.,46,false
32,6,http://lorempixel.com/640/480/food,Fri Jun 22 2018 14:26:59 GMT-0700 (PDT),Magnam numquam et vitae aut dolores corrupti vel sed quia.,49,false
0,18,http://lorempixel.com/640/480/food,Sun Mar 04 2018 21:21:31 GMT-0800 (PST),In beatae et similique vitae eius dolore accusamus ab et.,16,false
77,6,http://lorempixel.com/640/480/food,Fri Nov 07 2014 13:09:50 GMT-0800 (PST),Aut id voluptas aut pariatur fuga nihil voluptas error vero.,12,false
34,12,http://lorempixel.com/640/480/food,Fri Nov 17 2017 08:34:15 GMT-0800 (PST),Quia omnis quibusdam et hic exercitationem sed maxime enim assumenda.,18,false
84,30,http://lorempixel.com/640/480/food,Tue May 26 2015 15:37:41 GMT-0700 (PDT),Reprehenderit deleniti maxime ipsam quaerat quia quisquam veniam est minima.,15,false
97,35,http://lorempixel.com/640/480/food,Fri Oct 04 2013 20:14:26 GMT-0700 (PDT),Dolorum enim aut ratione omnis odit autem et sequi saepe.,35,false
63,16,http://lorempixel.com/640/480/food,Sun Aug 31 2014 16:47:53 GMT-0700 (PDT),Saepe veniam ad similique perspiciatis ex laboriosam est sint temporibus.,3,false
91,7,http://lorempixel.com/640/480/food,Sat Nov 18 2017 13:06:51 GMT-0800 (PST),Molestiae minima commodi natus ullam vitae voluptatem reiciendis in odit.,8,false
17,5,http://lorempixel.com/640/480/food,Sat May 27 2017 01:05:58 GMT-0700 (PDT),Minus aut hic fugiat maiores sequi nulla laboriosam numquam perspiciatis.,12,false
13,49,http://lorempixel.com/640/480/food,Tue Sep 05 2017 22:33:03 GMT-0700 (PDT),Reprehenderit omnis rerum animi possimus doloremque cum id laudantium sed.,36,false
48,24,http://lorempixel.com/640/480/food,Wed Jul 18 2018 08:50:43 GMT-0700 (PDT),Esse porro corrupti ut vitae enim ipsam est eligendi quaerat.,45,false
21,21,http://lorempixel.com/640/480/food,Sun Mar 29 2015 07:13:05 GMT-0700 (PDT),Ut in vel earum sit voluptates eaque culpa est et.,11,false
58,42,http://lorempixel.com/640/480/food,Sun May 25 2014 21:20:09 GMT-0700 (PDT),Reiciendis sed aut exercitationem repellat consectetur et quia quasi culpa.,44,false
64,27,http://lorempixel.com/640/480/food,Thu Feb 15 2018 11:07:14 GMT-0800 (PST),Dolores enim veniam ut quia dicta corrupti omnis et vero.,11,false
80,40,http://lorempixel.com/640/480/food,Fri Mar 24 2017 06:55:56 GMT-0700 (PDT),Dolor quod sunt dignissimos et ex natus amet vitae incidunt.,21,false
87,4,http://lorempixel.com/640/480/food,Wed May 14 2014 09:35:38 GMT-0700 (PDT),Velit facilis fuga reprehenderit omnis sed ea qui qui suscipit.,1,false
67,48,http://lorempixel.com/640/480/food,Thu Jul 13 2017 01:04:21 GMT-0700 (PDT),Velit officiis tempore aperiam quae sit ut dicta numquam iste.,0,false
4,25,http://lorempixel.com/640/480/food,Mon Aug 07 2017 22:40:30 GMT-0700 (PDT),Nisi distinctio ut fugit nobis voluptatum at cumque fuga laudantium.,4,false
83,36,http://lorempixel.com/640/480/food,Fri Jun 13 2014 15:56:19 GMT-0700 (PDT),Saepe facere deleniti eligendi velit at unde laborum qui fugit.,39,false
60,31,http://lorempixel.com/640/480/food,Wed Jan 10 2018 17:37:56 GMT-0800 (PST),Error ea autem rerum mollitia occaecati qui consequatur ea culpa.,4,false
49,32,http://lorempixel.com/640/480/food,Sun Jun 12 2016 14:56:33 GMT-0700 (PDT),Vel dolores itaque recusandae commodi laborum dolor earum nostrum quas.,6,false
93,31,http://lorempixel.com/640/480/food,Sun Jul 09 2017 18:18:26 GMT-0700 (PDT),Aliquid voluptatibus neque accusamus unde dolores doloribus consequatur deleniti explicabo.,39,false
64,47,http://lorempixel.com/640/480/food,Mon May 02 2016 22:29:17 GMT-0700 (PDT),Quis tempora sapiente nihil voluptatem doloribus aliquid dolorem quia alias.,5,false
73,0,http://lorempixel.com/640/480/food,Sat Dec 30 2017 11:15:00 GMT-0800 (PST),Delectus beatae deserunt suscipit eveniet recusandae itaque labore omnis et.,36,false
63,1,http://lorempixel.com/640/480/food,Thu Sep 07 2017 00:44:52 GMT-0700 (PDT),Animi iste mollitia molestiae ut id qui dolore placeat illum.,40,false
66,37,http://lorempixel.com/640/480/food,Mon Sep 05 2016 04:13:16 GMT-0700 (PDT),Praesentium facere officiis qui deserunt sit distinctio temporibus corrupti non.,1,false
84,30,http://lorempixel.com/640/480/food,Thu Jun 09 2016 00:26:59 GMT-0700 (PDT),Repellendus ut explicabo qui non sint enim repellendus ullam occaecati.,26,false
83,2,http://lorempixel.com/640/480/food,Sun Nov 08 2015 10:31:28 GMT-0800 (PST),Quo et incidunt cupiditate saepe dolore similique nihil eligendi et.,22,false
59,3,http://lorempixel.com/640/480/food,Wed Nov 22 2017 21:20:29 GMT-0800 (PST),Molestias est expedita occaecati consequatur accusamus fuga dolores quia ipsam.,22,false
3,35,http://lorempixel.com/640/480/food,Tue Jan 10 2017 23:04:42 GMT-0800 (PST),Voluptas sed molestiae voluptas unde cupiditate velit iure ut et.,29,false
50,39,http://lorempixel.com/640/480/food,Fri Feb 26 2016 13:42:01 GMT-0800 (PST),Minus laborum et assumenda voluptates consequuntur sed delectus exercitationem qui.,32,false
15,23,http://lorempixel.com/640/480/food,Sun Nov 20 2016 23:02:51 GMT-0800 (PST),Fugit error veritatis ut veniam porro asperiores porro distinctio sed.,42,false
4,41,http://lorempixel.com/640/480/food,Tue Apr 28 2015 22:53:26 GMT-0700 (PDT),Provident voluptas odit dignissimos nihil placeat aut dignissimos ipsa perferendis.,38,false
91,0,http://lorempixel.com/640/480/food,Thu Oct 13 2016 23:38:08 GMT-0700 (PDT),Doloribus aspernatur quis possimus ut sit quis ut eaque quia.,44,false
26,42,http://lorempixel.com/640/480/food,Wed Sep 03 2014 19:51:22 GMT-0700 (PDT),Ab accusantium et minima nisi id sint quis quibusdam consequatur.,45,false
60,38,http://lorempixel.com/640/480/food,Sun Jul 02 2017 17:58:43 GMT-0700 (PDT),Et esse quidem vel unde esse veritatis minima iste quae.,14,false
66,47,http://lorempixel.com/640/480/food,Mon Dec 12 2016 06:51:03 GMT-0800 (PST),Tempore omnis ducimus quo eius corrupti aut aliquam adipisci modi.,48,false
99,44,http://lorempixel.com/640/480/food,Sun Mar 06 2016 07:00:52 GMT-0800 (PST),Eos perferendis repudiandae ullam quas ut placeat sed ullam rerum.,0,false
9,20,http://lorempixel.com/640/480/food,Sat Jan 17 2015 20:45:56 GMT-0800 (PST),Omnis ullam quod maxime debitis qui esse qui ipsum sed.,37,false
17,25,http://lorempixel.com/640/480/food,Sun Dec 27 2015 02:41:43 GMT-0800 (PST),Nisi ipsum sit rerum culpa natus voluptatibus vel est non.,7,false
3,19,http://lorempixel.com/640/480/food,Sun Jan 26 2014 09:07:18 GMT-0800 (PST),Magnam et veniam cupiditate sit rem debitis et ratione iste.,32,false
6,47,http://lorempixel.com/640/480/food,Thu Aug 17 2017 19:57:33 GMT-0700 (PDT),Minus enim similique recusandae mollitia quasi sit natus expedita iure.,47,false
71,24,http://lorempixel.com/640/480/food,Tue Jan 21 2014 23:04:23 GMT-0800 (PST),Ea aperiam cum vel sit est est sint dolorem exercitationem.,38,false
3,40,http://lorempixel.com/640/480/food,Sat Nov 15 2014 16:44:48 GMT-0800 (PST),Et in molestias cum iste non illum sit voluptas dicta.,21,false
72,47,http://lorempixel.com/640/480/food,Sun Oct 19 2014 01:34:30 GMT-0700 (PDT),Consequuntur nam nisi sed eligendi in id officia vitae rerum.,14,false
45,18,http://lorempixel.com/640/480/food,Wed Jun 13 2018 04:36:51 GMT-0700 (PDT),Expedita eos rerum ut vero cumque minus necessitatibus facere est.,27,false
45,38,http://lorempixel.com/640/480/food,Tue Sep 22 2015 12:29:16 GMT-0700 (PDT),Id asperiores vitae qui quo eum et assumenda amet excepturi.,2,false
12,49,http://lorempixel.com/640/480/food,Fri Mar 31 2017 17:49:12 GMT-0700 (PDT),Excepturi quia quia nam deserunt itaque quidem reiciendis similique nemo.,31,false
87,40,http://lorempixel.com/640/480/food,Mon Jun 18 2018 09:59:14 GMT-0700 (PDT),Consectetur quisquam beatae nihil ad veniam repudiandae eos et adipisci.,41,false
2,46,http://lorempixel.com/640/480/food,Mon Jun 02 2014 05:44:07 GMT-0700 (PDT),Minima sapiente dolores suscipit quia est earum id voluptates libero.,48,false
20,23,http://lorempixel.com/640/480/food,Thu Jan 07 2016 00:22:34 GMT-0800 (PST),Eos sunt sed amet perspiciatis sint aut facilis harum ea.,21,false
31,17,http://lorempixel.com/640/480/food,Thu Jan 01 2015 20:36:10 GMT-0800 (PST),Veniam voluptatem ut unde cumque quasi dolor necessitatibus quos totam.,1,false
96,45,http://lorempixel.com/640/480/food,Tue Feb 20 2018 12:53:22 GMT-0800 (PST),Ipsum accusamus est ullam omnis maiores aliquam distinctio commodi ad.,25,false
13,24,http://lorempixel.com/640/480/food,Wed Jan 25 2017 19:38:31 GMT-0800 (PST),In iste non voluptas non mollitia nobis ab placeat labore.,30,false
1,2,http://lorempixel.com/640/480/food,Fri Aug 26 2016 07:10:08 GMT-0700 (PDT),Ex nihil rem eum laborum et ut rerum dolores doloribus.,5,false
34,1,http://lorempixel.com/640/480/food,Thu Dec 03 2015 20:17:56 GMT-0800 (PST),Assumenda qui qui ratione aut quibusdam et quo aliquam aut.,12,false
36,19,http://lorempixel.com/640/480/food,Sun Nov 19 2017 22:45:12 GMT-0800 (PST),Ut non delectus impedit eum et rem quod tempore tempora.,5,false
25,17,http://lorempixel.com/640/480/food,Wed Jun 22 2016 00:48:49 GMT-0700 (PDT),Deserunt eaque ut quis aut dolore reiciendis rerum quo minus.,3,false
4,28,http://lorempixel.com/640/480/food,Fri May 13 2016 08:57:50 GMT-0700 (PDT),Ab sed molestiae laboriosam placeat ducimus suscipit nisi et eum.,29,false
48,14,http://lorempixel.com/640/480/food,Fri Jun 09 2017 02:22:54 GMT-0700 (PDT),Accusamus similique deserunt quia ea nihil autem dolores nihil doloremque.,23,false
81,4,http://lorempixel.com/640/480/food,Wed Oct 19 2016 19:27:54 GMT-0700 (PDT),Qui possimus ab saepe autem deleniti voluptatem in enim accusantium.,27,false
87,16,http://lorempixel.com/640/480/food,Fri May 12 2017 18:31:19 GMT-0700 (PDT),Aut molestiae qui numquam exercitationem unde sint eveniet porro et.,3,false
92,21,http://lorempixel.com/640/480/food,Mon Apr 24 2017 04:46:47 GMT-0700 (PDT),Iusto natus rerum ad esse et nemo omnis nobis non.,37,false
10,2,http://lorempixel.com/640/480/food,Tue Feb 27 2018 00:24:12 GMT-0800 (PST),Et aut et perferendis voluptatem non illum dolor et temporibus.,21,false
72,20,http://lorempixel.com/640/480/food,Thu Jan 15 2015 15:26:57 GMT-0800 (PST),Dolorem animi esse corporis totam rerum debitis natus sunt quod.,28,false
53,7,http://lorempixel.com/640/480/food,Tue Aug 29 2017 07:27:03 GMT-0700 (PDT),Sunt rem minima maiores consequuntur et voluptatem est inventore rerum.,12,false
99,9,http://lorempixel.com/640/480/food,Thu Jan 29 2015 04:56:49 GMT-0800 (PST),Voluptatem repudiandae non vel iure reiciendis quas omnis doloremque sunt.,50,false
88,32,http://lorempixel.com/640/480/food,Mon Mar 31 2014 16:04:20 GMT-0700 (PDT),Voluptate eaque non nulla doloremque a dolorem sed ab iure.,4,false
18,11,http://lorempixel.com/640/480/food,Wed Apr 18 2018 07:52:08 GMT-0700 (PDT),Perspiciatis in ut laboriosam fuga at minima consequatur debitis dignissimos.,2,false
84,0,http://lorempixel.com/640/480/food,Fri Dec 23 2016 07:17:12 GMT-0800 (PST),Facere est aut laborum nemo id temporibus nihil laudantium sed.,21,false
73,6,http://lorempixel.com/640/480/food,Thu Oct 15 2015 18:24:06 GMT-0700 (PDT),Repellat aut esse delectus culpa et laboriosam consectetur quia ipsa.,9,false
54,14,http://lorempixel.com/640/480/food,Sat Jul 19 2014 00:58:33 GMT-0700 (PDT),Inventore laboriosam exercitationem autem ut quia eum occaecati et voluptatem.,45,false
84,23,http://lorempixel.com/640/480/food,Tue Jan 10 2017 09:33:42 GMT-0800 (PST),Saepe voluptas ut vel ipsum rem at veritatis dignissimos at.,1,false
34,35,http://lorempixel.com/640/480/food,Sun Feb 04 2018 07:13:12 GMT-0800 (PST),Rerum error debitis adipisci reprehenderit est et minus rem numquam.,13,false
13,29,http://lorempixel.com/640/480/food,Fri Jun 29 2018 07:49:51 GMT-0700 (PDT),Dolor est ut quas ad qui et assumenda nesciunt consequuntur.,8,false
83,3,http://lorempixel.com/640/480/food,Sun Jul 26 2015 14:10:32 GMT-0700 (PDT),Dolorem ut voluptates ut optio sint ratione hic ab ullam.,47,false
20,25,http://lorempixel.com/640/480/food,Fri May 29 2015 06:53:22 GMT-0700 (PDT),Et harum culpa consectetur iure est sequi eum non aperiam.,20,false
92,26,http://lorempixel.com/640/480/food,Sun Oct 22 2017 14:23:42 GMT-0700 (PDT),Vero minima et nulla architecto et fugit impedit aperiam tenetur.,26,false
77,36,http://lorempixel.com/640/480/food,Wed Jul 08 2015 19:47:49 GMT-0700 (PDT),Quae eum illum quod sed sed sed sit quidem reiciendis.,19,false
53,47,http://lorempixel.com/640/480/food,Thu Mar 03 2016 03:06:29 GMT-0800 (PST),Sunt inventore odit dolor autem vel non temporibus ullam ipsa.,38,false
23,38,http://lorempixel.com/640/480/food,Sat Apr 19 2014 21:23:53 GMT-0700 (PDT),Id inventore aut tempora consequuntur facilis et facilis atque dolorem.,15,false
26,48,http://lorempixel.com/640/480/food,Fri Dec 04 2015 04:40:11 GMT-0800 (PST),Sed molestiae id repellat sequi voluptatem minima dolorem voluptates repellat.,50,false
46,15,http://lorempixel.com/640/480/food,Tue Aug 28 2018 16:02:17 GMT-0700 (PDT),Quas omnis sint incidunt et accusantium labore est iusto excepturi.,0,false
37,17,http://lorempixel.com/640/480/food,Mon Jun 02 2014 19:55:12 GMT-0700 (PDT),Cum quia dolores beatae et aliquam et debitis dolorem necessitatibus.,21,false
23,42,http://lorempixel.com/640/480/food,Fri May 29 2015 21:08:17 GMT-0700 (PDT),At qui vero consequuntur repudiandae est error reiciendis tempore sunt.,17,false
31,16,http://lorempixel.com/640/480/food,Sun Jul 30 2017 06:40:31 GMT-0700 (PDT),Cumque et laudantium suscipit vero quos nesciunt aperiam ipsam nam.,37,false
42,26,http://lorempixel.com/640/480/food,Fri May 29 2015 00:22:23 GMT-0700 (PDT),Excepturi nesciunt unde eos nemo et sit modi repudiandae adipisci.,45,false
90,36,http://lorempixel.com/640/480/food,Thu Nov 12 2015 04:22:59 GMT-0800 (PST),Nemo dolorem necessitatibus cumque fugit officiis deserunt consequatur eligendi eligendi.,12,false
95,45,http://lorempixel.com/640/480/food,Sat May 30 2015 11:54:26 GMT-0700 (PDT),Quibusdam ipsam vel atque quia dignissimos natus molestiae esse natus.,42,false
7,27,http://lorempixel.com/640/480/food,Sun Nov 23 2014 18:03:42 GMT-0800 (PST),In et harum sit eveniet quasi occaecati aut ad qui.,14,false
87,28,http://lorempixel.com/640/480/food,Sun Jun 01 2014 22:56:34 GMT-0700 (PDT),Et voluptatem minima quia deserunt esse assumenda quos fuga repellat.,20,false
13,34,http://lorempixel.com/640/480/food,Mon Jun 01 2015 06:43:46 GMT-0700 (PDT),Distinctio error sit cum pariatur quasi ea harum est magnam.,6,false
