businessId,imageUploaderId,imageUrl,imageUploadDate,imageComment,helpfulCount,reported
19,50,http://lorempixel.com/640/480/food,Sun Jan 14 2018 21:53:38 GMT-0800 (PST),Quas iure aut tempora quos excepturi nam incidunt voluptatem in.,16,false
70,8,http://lorempixel.com/640/480/food,Sat May 16 2015 20:06:56 GMT-0700 (PDT),Autem delectus officia doloremque a fugiat et minus quia eos.,14,false
78,27,http://lorempixel.com/640/480/food,Tue Sep 09 2014 08:24:41 GMT-0700 (PDT),Quia tempore et placeat accusamus et libero quo nostrum molestiae.,48,false
15,6,http://lorempixel.com/640/480/food,Sun Apr 23 2017 14:03:33 GMT-0700 (PDT),Ex sunt dolore veritatis aut at deleniti dicta praesentium consequatur.,23,false
37,28,http://lorempixel.com/640/480/food,Fri Jun 10 2016 07:24:16 GMT-0700 (PDT),Necessitatibus incidunt et facilis aut sint placeat laborum qui beatae.,11,false
91,15,http://lorempixel.com/640/480/food,Sun Jun 11 2017 10:07:22 GMT-0700 (PDT),Iste libero repellendus doloremque et ipsam qui facilis est magni.,50,false
91,7,http://lorempixel.com/640/480/food,Wed Jan 31 2018 20:16:47 GMT-0800 (PST),Totam esse facilis debitis ratione quas dignissimos et consectetur nobis.,34,false
64,33,http://lorempixel.com/640/480/food,Wed Feb 18 2015 09:59:56 GMT-0800 (PST),Earum dolores qui sapiente sit sed in alias nobis minus.,49,false
43,23,http://lorempixel.com/640/480/food,Wed Mar 18 2015 11:22:37 GMT-0700 (PDT),Nisi distinctio voluptas ut ratione temporibus ad neque sed blanditiis.,36,false
39,33,http://lorempixel.com/640/480/food,Sat Nov 19 2016 06:29:27 GMT-0800 (PST),Placeat dicta eos aut vero aperiam accusantium nisi in dolorem.,15,false
46,6,http://lorempixel.com/640/480/food,Tue Jan 10 2017 17:02:12 GMT-0800 (PST),Libero cum architecto voluptas nihil laboriosam quibusdam maiores nostrum nostrum.,38,false
11,22,http://lorempixel.com/640/480/food,Fri Dec 20 2013 21:03:39 GMT-0800 (PST),Ad quas ea sint et non eligendi voluptate et rerum.,35,false
78,19,http://lorempixel.com/640/480/food,Sat Oct 26 2013 05:49:16 GMT-0700 (PDT),Reprehenderit praesentium maxime similique fugit voluptas quo in illum molestiae.,39,false
45,20,http://lorempixel.com/640/480/food,Tue Jun 03 2014 17:30:55 GMT-0700 (PDT),Sequi aut numquam odit laudantium error qui quis eum aut.,42,false
82,49,http://lorempixel.com/640/480/food,Sun Nov 03 2013 21:00:21 GMT-0800 (PST),Beatae exercitationem odit cumque labore reiciendis suscipit dolor impedit eaque.,40,false
23,5,http://lorempixel.com/640/480/food,Wed Dec 23 2015 02:27:34 GMT-0800 (PST),Et nulla voluptate itaque quidem debitis sit similique quis quasi.,5,false
72,30,http://lorempixel.com/640/480/food,Sun Oct 13 2013 13:45:36 GMT-0700 (PDT),Distinctio voluptatem sit saepe illo iure placeat fugit quae rerum.,38,false
16,19,http://lorempixel.com/640/480/food,Sat Mar 05 2016 08:01:08 GMT-0800 (PST),Optio rem aut aut qui et ut dolor sed corporis.,13,false
100,47,http://lorempixel.com/640/480/food,Fri May 29 2015 07:59:09 GMT-0700 (PDT),Eos voluptates consequatur eum quaerat vero libero earum ipsa quod.,18,false
18,7,http://lorempixel.com/640/480/food,Tue Dec 19 2017 03:35:06 GMT-0800 (PST),Id aut sapiente suscipit beatae molestias tempora aut quidem repellendus.,2,false
14,45,http://lorempixel.com/640/480/food,Mon Nov 11 2013 15:30:47 GMT-0800 (PST),Illum aspernatur repellendus reprehenderit aut qui id non tempora modi.,10,false
46,47,http://lorempixel.com/640/480/food,Tue Feb 07 2017 17:21:14 GMT-0800 (PST),Quod provident quo iste atque facere tempore non quae expedita.,19,false
49,0,http://lorempixel.com/640/480/food,Wed Jul 23 2014 12:14:11 GMT-0700 (PDT),Error tenetur quia placeat consequatur fugit eius est perferendis sint.,22,false
23,2,http://lorempixel.com/640/480/food,Sat Oct 18 2014 17:26:47 GMT-0700 (PDT),Possimus velit consequatur rem dolores consectetur ut provident dolores voluptatem.,5,false
89,48,http://lorempixel.com/640/480/food,Thu Jan 09 2014 12:36:27 GMT-0800 (PST),Fuga illo omnis harum aliquam labore cum sunt temporibus soluta.,25,false
76,24,http://lorempixel.com/640/480/food,Thu Jan 18 2018 15:33:57 GMT-0800 (PST),Suscipit repellendus ea id numquam non soluta non rerum provident.,18,false
1,35,http://lorempixel.com/640/480/food,Fri Sep 09 2016 09:54:33 GMT-0700 (PDT),Veniam neque voluptas nobis ratione eos vitae numquam assumenda at.,30,false
8,5,http://lorempixel.com/640/480/food,Fri Jul 18 2014 03:00:31 GMT-0700 (PDT),Pariatur eum non aut qui natus accusamus voluptatem qui molestiae.,47,false
53,41,http://lorempixel.com/640/480/food,Mon Jul 17 2017 13:41:52 GMT-0700 (PDT),Eaque nisi qui repellat sunt quos rerum perspiciatis voluptatem quos.,0,false
18,47,http://lorempixel.com/640/480/food,Wed Jan 01 2014 16:10:40 GMT-0800 (PST),Delectus aut repudiandae id similique dolor ullam ut deserunt laudantium.,6,false
89,49,http://lorempixel.com/640/480/food,Fri Jan 10 2014 19:59:07 GMT-0800 (PST),Quia recusandae adipisci accusantium explicabo eos ea dolorem dignissimos voluptas.,34,false
66,36,http://lorempixel.com/640/480/food,Sat May 12 2018 13:50:03 GMT-0700 (PDT),Odit dolor explicabo facere maiores aperiam nesciunt saepe voluptates odio.,24,false
34,23,http://lorempixel.com/640/480/food,Tue May 26 2015 02:51:18 GMT-0700 (PDT),Laborum ex exercitationem numquam sint dolor optio dolore eveniet suscipit.,46,false
32,24,http://lorempixel.com/640/480/food,Sun Mar 27 2016 05:50:08 GMT-0700 (PDT),In qui est quaerat aut accusantium nostrum aut officia fugiat.,35,false
96,45,http://lorempixel.com/640/480/food,Thu Dec 18 2014 22:33:08 GMT-0800 (PST),Nemo aut beatae consequatur aliquam nisi voluptatem totam aut exercitationem.,11,false
78,27,http://lorempixel.com/640/480/food,Mon Oct 20 2014 10:22:03 GMT-0700 (PDT),Consectetur error ullam ratione porro debitis possimus maiores quia est.,28,false
4,8,http://lorempixel.com/640/480/food,Mon May 08 2017 02:42:33 GMT-0700 (PDT),Sint repellat consequatur praesentium officiis ut unde magnam esse veniam.,36,false
19,49,http://lorempixel.com/640/480/food,Sat Mar 14 2015 18:04:11 GMT-0700 (PDT),Porro dolorem sit et saepe esse reiciendis architecto dolores sit.,9,false
27,38,http://lorempixel.com/640/480/food,Sat Jan 23 2016 07:09:48 GMT-0800 (PST),Optio est rerum consequuntur voluptates inventore quia quia quos quis.,8,false
28,14,http://lorempixel.com/640/480/food,Tue Dec 12 2017 18:11:08 GMT-0800 (PST),Aspernatur nesciunt repudiandae omnis ea ea eius quos nam sed.,15,false
65,30,http://lorempixel.com/640/480/food,Wed Aug 02 2017 22:54:56 GMT-0700 (PDT),Corrupti quis deserunt ut voluptatum aut laboriosam fuga quae ducimus.,13,false
93,21,http://lorempixel.com/640/480/food,Tue Jan 12 2016 23:31:37 GMT-0800 (PST),Qui asperiores id quae et quia porro magnam eum dolorem.,23,false
21,16,http://lorempixel.com/640/480/food,Thu Sep 18 2014 09:56:00 GMT-0700 (PDT),Soluta temporibus aliquid repellat aut dolor quas tempore doloremque libero.,8,false
61,23,http://lorempixel.com/640/480/food,Thu Sep 10 2015 17:34:04 GMT-0700 (PDT),Et aspernatur excepturi dolorem placeat nihil reprehenderit expedita quis cupiditate.,40,false
14,38,http://lorempixel.com/640/480/food,Thu Jul 03 2014 05:18:07 GMT-0700 (PDT),Et repudiandae mollitia sed repellat aut sed odit laborum aspernatur.,13,false
85,41,http://lorempixel.com/640/480/food,Thu Dec 24 2015 06:14:05 GMT-0800 (PST),Perspiciatis in aut dicta ea exercitationem nulla maxime reprehenderit ut.,16,false
56,5,http://lorempixel.com/640/480/food,Thu Mar 16 2017 14:51:05 GMT-0700 (PDT),Nisi aperiam facilis mollitia sit praesentium sit tenetur ipsam sint.,5,false
15,43,http://lorempixel.com/640/480/food,Mon Feb 08 2016 11:46:04 GMT-0800 (PST),Aut fuga asperiores non qui magnam ipsam quis eaque autem.,10,false
68,20,http://lorempixel.com/640/480/food,Fri Nov 06 2015 13:42:26 GMT-0800 (PST),Debitis corporis et et et consequuntur quia laboriosam voluptatem ipsam.,3,false
73,46,http://lorempixel.com/640/480/food,Wed Aug 22 2018 05:15:21 GMT-0700 (PDT),Dicta quod in perspiciatis dignissimos porro distinctio tempora quasi nesciunt.,7,false
38,23,http://lorempixel.com/640/480/food,Tue Apr 10 2018 20:42:48 GMT-0700 (PDT),Sed non totam et fuga libero rerum est quis quia.,47,false
94,15,http://lorempixel.com/640/480/food,Wed Mar 22 2017 23:01:30 GMT-0700 (PDT),Repellat nesciunt ut consequatur reiciendis et et non consequatur velit.,35,false
80,29,http://lorempixel.com/640/480/food,Wed Dec 10 2014 13:26:42 GMT-0800 (PST),Et sit molestiae omnis blanditiis qui facere similique fuga repellendus.,39,false
31,12,http://lorempixel.com/640/480/food,Tue May 02 2017 05:24:17 GMT-0700 (PDT),Perspiciatis sapiente voluptas reprehenderit non quaerat sit at modi ea.,8,false
82,6,http://lorempixel.com/640/480/food,Fri May 29 2015 17:58:41 GMT-0700 (PDT),Atque iste qui aut tempora quaerat sit ducimus nulla assumenda.,8,false
72,34,http://lorempixel.com/640/480/food,Mon Jun 08 2015 13:07:13 GMT-0700 (PDT),Harum eum nam laudantium delectus dolorem consequatur non sed expedita.,17,false
46,29,http://lorempixel.com/640/480/food,Mon Jun 06 2016 05:55:56 GMT-0700 (PDT),Aut iure ipsum illo eos qui repellendus ut dolores sapiente.,22,false
77,12,http://lorempixel.com/640/480/food,Tue Aug 04 2015 01:06:37 GMT-0700 (PDT),Autem architecto velit quas nihil ipsa quos dolore et ullam.,24,false
66,34,http://lorempixel.com/640/480/food,Mon Oct 26 2015 00:29:43 GMT-0700 (PDT),Vel corporis cumque beatae unde molestiae tempore similique doloribus magnam.,5,false
74,42,http://lorempixel.com/640/480/food,Thu Dec 26 2013 17:32:54 GMT-0800 (PST),Est incidunt sunt est illum ipsa itaque porro quibusdam ut.,2,false
52,49,http://lorempixel.com/640/480/food,Sat Mar 22 2014 22:10:28 GMT-0700 (PDT),Blanditiis beatae et quasi saepe dolor nihil earum officiis dolor.,10,false
3,2,http://lorempixel.com/640/480/food,Tue Oct 07 2014 22:00:42 GMT-0700 (PDT),Omnis assumenda velit veritatis consequuntur aliquid repellendus corporis voluptas eius.,6,false
77,37,http://lorempixel.com/640/480/food,Sun Feb 16 2014 10:25:22 GMT-0800 (PST),In ipsam at inventore dolore quia natus enim architecto doloremque.,29,false
96,21,http://lorempixel.com/640/480/food,Mon May 14 2018 02:46:39 GMT-0700 (PDT),Ab voluptas nisi atque dolorem quaerat ut non omnis ratione.,10,false
57,2,http://lorempixel.com/640/480/food,Mon Jul 20 2015 00:52:10 GMT-0700 (PDT),Quis debitis aut et et omnis voluptas provident maxime sunt.,31,false
31,20,http://lorempixel.com/640/480/food,Mon Aug 18 2014 19:53:44 GMT-0700 (PDT),Voluptas accusamus dolores quas error nostrum nulla quo consequatur vel.,15,false
14,24,http://lorempixel.com/640/480/food,Fri Dec 08 2017 06:55:32 GMT-0800 (PST),Esse molestias est ut est est et architecto ut at.,32,false
44,2,http://lorempixel.com/640/480/food,Wed Aug 10 2016 23:14:39 GMT-0700 (PDT),Ea iure aliquam omnis placeat quod id quis mollitia hic.,40,false
34,26,http://lorempixel.com/640/480/food,Sun Jul 16 2017 17:04:22 GMT-0700 (PDT),Voluptas consectetur possimus rerum omnis illo culpa quas qui officiis.,6,false
22,25,http://lorempixel.com/640/480/food,Thu Feb 09 2017 03:45:14 GMT-0800 (PST),Perferendis ut quo quis aliquid ut aut quo voluptatibus dicta.,17,false
66,34,http://lorempixel.com/640/480/food,Tue Sep 26 2017 19:38:19 GMT-0700 (PDT),Similique magni delectus non commodi pariatur hic ut non libero.,2,false
61,47,http://lorempixel.com/640/480/food,Tue Mar 11 2014 20:18:37 GMT-0700 (PDT),Et omnis similique esse accusantium vitae et aliquid temporibus eligendi.,26,false
80,30,http://lorempixel.com/640/480/food,Wed Dec 09 2015 04:54:06 GMT-0800 (PST),Asperiores enim voluptate quibusdam neque et iste aut aperiam architecto.,49,false
96,44,http://lorempixel.com/640/480/food,Thu Jun 26 2014 22:53:57 GMT-0700 (PDT),Ut quod cupiditate doloribus id fugit sapiente aut veritatis at.,30,false
88,46,http://lorempixel.com/640/480/food,Mon Apr 16 2018 21:23:33 GMT-0700 (PDT),Tempora ex saepe dolor tempora libero cumque aut quas vero.,19,false
9,33,http://lorempixel.com/640/480/food,Sat Sep 28 2013 19:27:45 GMT-0700 (PDT),Velit saepe quia repellendus voluptatibus qui quibusdam omnis esse nihil.,34,false
61,4,http://lorempixel.com/640/480/food,Sat Sep 13 2014 10:23:31 GMT-0700 (PDT),Dolorem aut nihil vitae vel ducimus maiores dolorum repudiandae animi.,33,false
39,1,http://lorempixel.com/640/480/food,Thu Aug 10 2017 12:39:45 GMT-0700 (PDT),Ratione id modi rerum ducimus enim dolor laboriosam ut et.,49,false
54,25,http://lorempixel.com/640/480/food,Fri Apr 21 2017 14:52:01 GMT-0700 (PDT),Quia nesciunt officiis impedit modi facere eum suscipit occaecati asperiores.,5,false
36,43,http://lorempixel.com/640/480/food,Wed Oct 05 2016 10:09:24 GMT-0700 (PDT),Consequatur voluptate sunt laboriosam sit architecto harum et mollitia inventore.,17,false
11,18,http://lorempixel.com/640/480/food,Sat Nov 11 2017 10:33:32 GMT-0800 (PST),Nostrum rerum aut quas alias ipsa ad non laborum voluptatibus.,38,false
14,28,http://lorempixel.com/640/480/food,Wed May 13 2015 03:59:50 GMT-0700 (PDT),Aut debitis deleniti eligendi nulla quia repellendus assumenda voluptate eaque.,34,false
99,42,http://lorempixel.com/640/480/food,Sun Nov 05 2017 17:24:49 GMT-0800 (PST),Voluptatem quae ea ducimus aliquam rem ipsum laborum aliquam non.,14,false
16,30,http://lorempixel.com/640/480/food,Sat Jul 29 2017 17:09:23 GMT-0700 (PDT),Quia repudiandae magnam necessitatibus autem officia sed est impedit vero.,10,false
77,28,http://lorempixel.com/640/480/food,Tue Jan 09 2018 14:25:16 GMT-0800 (PST),Odio in sed expedita quae non vel facere omnis voluptatem.,42,false
29,35,http://lorempixel.com/640/480/food,Sat Dec 02 2017 17:29:27 GMT-0800 (PST),Error eos molestias placeat deserunt laboriosam eligendi sunt rerum ratione.,0,false
44,16,http://lorempixel.com/640/480/food,Tue Sep 04 2018 21:35:59 GMT-0700 (PDT),Porro dolorem natus dolores eaque quia quo doloremque nihil veniam.,2,false
79,36,http://lorempixel.com/640/480/food,Wed Nov 11 2015 15:51:56 GMT-0800 (PST),Ut pariatur debitis explicabo in voluptatem earum eaque tenetur consequuntur.,34,false
40,3,http://lorempixel.com/640/480/food,Wed Feb 04 2015 09:05:26 GMT-0800 (PST),Omnis dolores dolor aut repellendus nulla maxime numquam neque autem.,41,false
79,1,http://lorempixel.com/640/480/food,Fri Feb 27 2015 16:31:41 GMT-0800 (PST),Nesciunt ea et aliquam aut quos fugiat qui autem qui.,39,false
22,42,http://lorempixel.com/640/480/food,Tue Jan 10 2017 13:47:38 GMT-0800 (PST),Eveniet id aut beatae nihil totam eum vel quas nemo.,12,false
4,27,http://lorempixel.com/640/480/food,Wed Sep 28 2016 03:33:08 GMT-0700 (PDT),Explicabo a et delectus dignissimos et nisi quo quia facilis.,23,false
43,14,http://lorempixel.com/640/480/food,Tue Nov 04 2014 03:47:36 GMT-0800 (PST),Velit temporibus mollitia eius delectus reiciendis rerum et distinctio est.,13,false
55,24,http://lorempixel.com/640/480/food,Fri Jun 30 2017 22:37:52 GMT-0700 (PDT),Ea autem ullam placeat unde laborum non voluptas quas est.,30,false
81,15,http://lorempixel.com/640/480/food,Wed Jun 14 2017 16:08:22 GMT-0700 (PDT),Aperiam ad omnis nihil vero rerum est occaecati eos repudiandae.,10,false
39,36,http://lorempixel.com/640/480/food,Sun May 10 2015 06:12:26 GMT-0700 (PDT),Illum aliquam quibusdam doloribus sit assumenda dolorem error magnam nisi.,4,false
84,26,http://lorempixel.com/640/480/food,Thu May 11 2017 04:10:33 GMT-0700 (PDT),A repudiandae ducimus maiores aut consequatur nihil placeat iste maiores.,31,false
17,6,http://lorempixel.com/640/480/food,Fri Sep 07 2018 22:06:31 GMT-0700 (PDT),Ratione aliquid molestiae et dicta fuga perferendis architecto voluptate laboriosam.,39,false
90,31,http://lorempixel.com/640/480/food,Wed Feb 12 2014 08:40:49 GMT-0800 (PST),Minus ab eligendi maxime maxime iure natus totam qui laborum.,17,false
0,46,http://lorempixel.com/640/480/food,Wed Mar 22 2017 00:17:01 GMT-0700 (PDT),Et vitae quidem deleniti quia est doloribus nemo est et.,31,false
37,30,http://lorempixel.com/640/480/food,Thu Mar 30 2017 21:30:39 GMT-0700 (PDT),Officiis impedit numquam culpa magnam et fugit iste vel magnam.,8,false
65,4,http://lorempixel.com/640/480/food,Sun Feb 11 2018 22:06:12 GMT-0800 (PST),Aliquam modi magni ducimus libero saepe voluptas eos voluptates fugiat.,50,false
60,16,http://lorempixel.com/640/480/food,Tue Jul 22 2014 19:39:27 GMT-0700 (PDT),Facilis eaque accusantium ullam facere quia aut iusto officia similique.,15,false
73,44,http://lorempixel.com/640/480/food,Tue May 09 2017 07:58:40 GMT-0700 (PDT),Suscipit hic adipisci id non suscipit recusandae voluptas at et.,33,false
53,37,http://lorempixel.com/640/480/food,Sun Jan 24 2016 19:15:23 GMT-0800 (PST),Molestiae ex tempore cum commodi non aliquam non non dolore.,10,false
97,37,http://lorempixel.com/640/480/food,Mon Jul 11 2016 16:11:30 GMT-0700 (PDT),Ea eaque quae molestias dignissimos nulla ad id eligendi dolorem.,20,false
12,38,http://lorempixel.com/640/480/food,Fri Aug 15 2014 23:47:10 GMT-0700 (PDT),Recusandae incidunt sit officiis in reiciendis sit iste ullam sint.,32,false
72,5,http://lorempixel.com/640/480/food,Mon Feb 23 2015 05:21:10 GMT-0800 (PST),Quod suscipit eos repellat omnis mollitia facilis omnis amet nihil.,30,false
52,10,http://lorempixel.com/640/480/food,Sat Oct 05 2013 05:51:54 GMT-0700 (PDT),Quia placeat doloribus alias ut nobis modi recusandae enim possimus.,18,false
74,19,http://lorempixel.com/640/480/food,Sun Jul 06 2014 02:43:10 GMT-0700 (PDT),Voluptatibus voluptatum excepturi rerum tenetur possimus nam veritatis cupiditate iusto.,29,false
3,24,http://lorempixel.com/640/480/food,Fri Jan 29 2016 00:35:57 GMT-0800 (PST),Illum nihil pariatur doloribus voluptatem dolor consectetur facere est iure.,20,false
55,5,http://lorempixel.com/640/480/food,Sun Dec 24 2017 02:32:57 GMT-0800 (PST),Sit aut ratione laboriosam autem soluta sunt voluptate porro delectus.,42,false
31,13,http://lorempixel.com/640/480/food,Sat Mar 22 2014 16:31:33 GMT-0700 (PDT),Voluptas placeat enim ut et odio quia mollitia tempora harum.,18,false
1,3,http://lorempixel.com/640/480/food,Sun Aug 21 2016 09:42:40 GMT-0700 (PDT),Dolores distinctio voluptatibus sit labore architecto consequatur eius nisi non.,11,false
37,36,http://lorempixel.com/640/480/food,Sun Oct 12 2014 08:49:25 GMT-0700 (PDT),Explicabo minima pariatur sapiente nihil velit laborum qui incidunt deserunt.,42,false
52,24,http://lorempixel.com/640/480/food,Sat Aug 22 2015 05:45:25 GMT-0700 (PDT),A ea esse et voluptas quis tempore ex neque animi.,43,false
1,7,http://lorempixel.com/640/480/food,Sat Feb 28 2015 13:21:54 GMT-0800 (PST),Cum est saepe ducimus aspernatur iure distinctio quibusdam veniam sint.,1,false
62,19,http://lorempixel.com/640/480/food,Fri Feb 16 2018 21:41:40 GMT-0800 (PST),Dolor enim velit ipsam sunt voluptatem aut porro et facilis.,6,false
76,15,http://lorempixel.com/640/480/food,Thu Jun 02 2016 13:12:03 GMT-0700 (PDT),Eos fugit ut quae autem laudantium debitis debitis maiores sunt.,37,false
61,3,http://lorempixel.com/640/480/food,Sat Dec 03 2016 17:52:07 GMT-0800 (PST),Aut autem quos quaerat accusantium quo unde eligendi consequatur dicta.,42,false
55,44,http://lorempixel.com/640/480/food,Mon Jul 11 2016 00:47:42 GMT-0700 (PDT),Illum cupiditate ullam aut fuga voluptatum quis ex dolor quis.,35,false
89,45,http://lorempixel.com/640/480/food,Mon May 12 2014 09:40:57 GMT-0700 (PDT),Pariatur aut omnis ut modi repellat rerum et aut unde.,33,false
49,29,http://lorempixel.com/640/480/food,Mon May 02 2016 15:29:56 GMT-0700 (PDT),Placeat dicta est odio consectetur ut sed quos possimus necessitatibus.,28,false
22,40,http://lorempixel.com/640/480/food,Sat Oct 19 2013 22:00:56 GMT-0700 (PDT),Fuga sit sint velit perspiciatis eligendi voluptas aut beatae qui.,1,false
41,37,http://lorempixel.com/640/480/food,Sun Mar 08 2015 07:05:48 GMT-0700 (PDT),Iste rerum eaque animi maiores vel ut non debitis harum.,23,false
27,43,http://lorempixel.com/640/480/food,Tue Aug 01 2017 01:22:46 GMT-0700 (PDT),Sed dolorum incidunt laudantium nisi nisi quod veniam et quia.,26,false
43,26,http://lorempixel.com/640/480/food,Wed Dec 09 2015 04:19:00 GMT-0800 (PST),Possimus quis illum nobis et sed est ea velit facilis.,18,false
55,44,http://lorempixel.com/640/480/food,Thu Feb 15 2018 20:05:38 GMT-0800 (PST),Corrupti quia ut ducimus velit dolore corrupti et eligendi et.,48,false
36,28,http://lorempixel.com/640/480/food,Tue Oct 03 2017 19:11:54 GMT-0700 (PDT),Delectus ipsum nobis aut officia et adipisci autem quia nisi.,9,false
77,46,http://lorempixel.com/640/480/food,Sat Jul 25 2015 06:11:09 GMT-0700 (PDT),Quasi nesciunt sunt est et vel minus modi molestiae omnis.,45,false
44,49,http://lorempixel.com/640/480/food,Thu Apr 28 2016 08:18:51 GMT-0700 (PDT),Numquam debitis in quasi assumenda recusandae saepe fugiat veniam sequi.,8,false
51,24,http://lorempixel.com/640/480/food,Mon Jul 13 2015 13:13:30 GMT-0700 (PDT),Sint in rem nostrum nam tenetur iste rem qui harum.,37,false
58,20,http://lorempixel.com/640/480/food,Fri Apr 08 2016 08:31:05 GMT-0700 (PDT),Dolores magnam est dolores officia officia animi ut consequatur omnis.,41,false
48,3,http://lorempixel.com/640/480/food,Wed May 24 2017 09:29:54 GMT-0700 (PDT),Ea facere fuga molestias fuga ipsam eligendi quia quae sed.,15,false
4,23,http://lorempixel.com/640/480/food,Fri Jun 02 2017 16:57:15 GMT-0700 (PDT),Voluptatibus sit autem expedita numquam eligendi eum voluptatem aperiam nisi.,47,false
90,8,http://lorempixel.com/640/480/food,Wed Oct 18 2017 23:41:05 GMT-0700 (PDT),Consequuntur dolores et autem vel dolore amet qui tempore rerum.,29,false
54,5,http://lorempixel.com/640/480/food,Fri Sep 12 2014 06:27:40 GMT-0700 (PDT),Vel et ad enim magni architecto eos id velit pariatur.,30,false
63,33,http://lorempixel.com/640/480/food,Wed Jul 08 2015 09:34:56 GMT-0700 (PDT),Labore ut sit voluptate nisi quia commodi qui quas minus.,1,false
13,35,http://lorempixel.com/640/480/food,Sat Mar 18 2017 17:31:19 GMT-0700 (PDT),Perspiciatis laborum similique autem ipsum dolorem expedita a commodi accusantium.,38,false
26,42,http://lorempixel.com/640/480/food,Sat May 27 2017 11:16:24 GMT-0700 (PDT),Ut consequatur dolorum ea ut voluptatem molestiae consequatur repellat nihil.,32,false
64,3,http://lorempixel.com/640/480/food,Sat Dec 24 2016 19:42:28 GMT-0800 (PST),Eum et laboriosam impedit temporibus cum in nostrum rerum alias.,23,false
30,11,http://lorempixel.com/640/480/food,Sat May 30 2015 13:05:51 GMT-0700 (PDT),Eligendi nemo et placeat impedit doloremque et nam quasi sed.,26,false
86,17,http://lorempixel.com/640/480/food,Mon Aug 21 2017 22:58:28 GMT-0700 (PDT),Nobis iste voluptatem qui ut hic et ut quia assumenda.,33,false
0,1,http://lorempixel.com/640/480/food,Sun Feb 18 2018 16:40:04 GMT-0800 (PST),At nesciunt dolores velit cupiditate aspernatur laboriosam magni officiis ad.,32,false
67,39,http://lorempixel.com/640/480/food,Sat Oct 25 2014 23:20:00 GMT-0700 (PDT),Aut a odio velit est quis minima ipsam ut adipisci.,47,false
19,15,http://lorempixel.com/640/480/food,Wed Aug 15 2018 22:31:02 GMT-0700 (PDT),Veritatis aliquid aut repudiandae dolores sit assumenda culpa non mollitia.,30,false
84,0,http://lorempixel.com/640/480/food,Tue Sep 27 2016 01:07:31 GMT-0700 (PDT),Aut et distinctio odio fuga tenetur enim voluptas molestiae iusto.,34,false
38,7,http://lorempixel.com/640/480/food,Sat Aug 02 2014 08:43:23 GMT-0700 (PDT),Nobis illo numquam cum consequatur distinctio repellendus suscipit dicta quia.,26,false
30,3,http://lorempixel.com/640/480/food,Mon Jul 06 2015 15:19:11 GMT-0700 (PDT),Sit aspernatur debitis consequatur reprehenderit optio voluptas doloribus adipisci iure.,49,false
36,22,http://lorempixel.com/640/480/food,Mon Apr 07 2014 16:09:39 GMT-0700 (PDT),Quod omnis consequuntur cum similique laboriosam sit doloremque quod corrupti.,3,false
57,2,http://lorempixel.com/640/480/food,Thu Dec 04 2014 20:57:09 GMT-0800 (PST),Aut facere odit nam sequi dolor libero harum atque inventore.,9,false
10,50,http://lorempixel.com/640/480/food,Thu Sep 28 2017 20:32:32 GMT-0700 (PDT),Corporis dolores nobis est ullam perferendis delectus doloribus sed quod.,20,false
41,39,http://lorempixel.com/640/480/food,Wed Nov 22 2017 17:29:27 GMT-0800 (PST),Ratione temporibus quaerat ipsum aperiam quam quia suscipit quos harum.,21,false
92,24,http://lorempixel.com/640/480/food,Thu Jul 23 2015 19:07:16 GMT-0700 (PDT),Iusto perferendis provident soluta non doloremque ad aut consequatur architecto.,3,false
74,20,http://lorempixel.com/640/480/food,Sat Aug 27 2016 12:13:14 GMT-0700 (PDT),Natus officia voluptates hic dolores est laborum tenetur ipsa consectetur.,30,false
69,37,http://lorempixel.com/640/480/food,Tue Sep 13 2016 17:08:45 GMT-0700 (PDT),Et voluptatem omnis ullam laborum illum voluptatem maxime et sit.,5,false
93,42,http://lorempixel.com/640/480/food,Thu Oct 31 2013 08:06:30 GMT-0700 (PDT),Quia sit omnis est soluta eos eos dicta commodi qui.,26,false
59,25,http://lorempixel.com/640/480/food,Wed May 07 2014 10:58:55 GMT-0700 (PDT),Fugit maiores fuga quia in sint vel eos est atque.,4,false
81,20,http://lorempixel.com/640/480/food,Thu Dec 12 2013 23:31:45 GMT-0800 (PST),Possimus temporibus amet natus est dignissimos molestias sequi blanditiis voluptas.,33,false
3,34,http://lorempixel.com/640/480/food,Sat Jul 08 2017 08:42:00 GMT-0700 (PDT),Quasi sunt quisquam incidunt facere dignissimos et modi veniam qui.,39,false
79,49,http://lorempixel.com/640/480/food,Sun Dec 07 2014 14:27:59 GMT-0800 (PST),Molestias voluptatem velit laboriosam molestiae et dolores vel et est.,30,false
19,22,http://lorempixel.com/640/480/food,Sun Nov 23 2014 18:40:32 GMT-0800 (PST),Quia dolores cupiditate sit eum similique repellat et soluta amet.,20,false
20,18,http://lorempixel.com/640/480/food,Sun Jun 11 2017 16:23:23 GMT-0700 (PDT),Inventore quo quam ullam labore debitis soluta quibusdam vel magni.,9,false
8,37,http://lorempixel.com/640/480/food,Wed Sep 20 2017 01:44:07 GMT-0700 (PDT),Dolore quia deleniti assumenda possimus voluptatum ab in ad porro.,41,false
