businessId,imageUploaderId,imageUrl,imageUploadDate,imageComment,helpfulCount,reported
26,6,http://lorempixel.com/640/480/food,Fri Feb 26 2016 20:28:58 GMT-0800 (PST),Voluptates aperiam officia qui cumque modi architecto inventore accusamus debitis.,4,false
40,37,http://lorempixel.com/640/480/food,Thu Sep 07 2017 01:42:26 GMT-0700 (PDT),Est quos ut temporibus dolore quasi aliquid laborum est voluptatum.,6,false
50,34,http://lorempixel.com/640/480/food,Mon Jul 11 2016 10:58:30 GMT-0700 (PDT),Eos molestias veritatis dolor ea similique sed architecto qui quos.,33,false
6,30,http://lorempixel.com/640/480/food,Sat Nov 14 2015 08:18:31 GMT-0800 (PST),Corrupti in consectetur suscipit suscipit sed fugiat qui incidunt beatae.,3,false
15,44,http://lorempixel.com/640/480/food,Sat Jul 05 2014 12:12:55 GMT-0700 (PDT),Assumenda veniam quis non natus quia natus vel vitae voluptas.,29,false
57,28,http://lorempixel.com/640/480/food,Wed Dec 17 2014 07:43:09 GMT-0800 (PST),Quam a est ipsa aliquid error in delectus harum vitae.,22,false
21,6,http://lorempixel.com/640/480/food,Mon Dec 12 2016 18:44:32 GMT-0800 (PST),Soluta ad maiores sed consequatur non laborum aut ut sint.,44,false
48,2,http://lorempixel.com/640/480/food,Fri Feb 07 2014 20:59:50 GMT-0800 (PST),Et veritatis laboriosam rerum sequi dolores totam sequi qui sequi.,41,false
20,45,http://lorempixel.com/640/480/food,Mon Jan 02 2017 06:51:56 GMT-0800 (PST),Repellat est laborum sint corporis eos aut eius ea culpa.,9,false
36,16,http://lorempixel.com/640/480/food,Fri Feb 27 2015 09:49:35 GMT-0800 (PST),Eligendi esse soluta non omnis quo dolorem est ea placeat.,47,false
60,43,http://lorempixel.com/640/480/food,Sat Nov 28 2015 00:12:35 GMT-0800 (PST),Pariatur dolorem tempora id sunt ut iste adipisci laudantium et.,3,false
66,38,http://lorempixel.com/640/480/food,Mon Jul 14 2014 22:48:31 GMT-0700 (PDT),Nihil accusamus sint dignissimos neque ea aut tenetur aut saepe.,10,false
27,35,http://lorempixel.com/640/480/food,Sat May 20 2017 21:16:19 GMT-0700 (PDT),Facilis delectus consequatur rem fuga et molestiae quasi et doloremque.,40,false
69,37,http://lorempixel.com/640/480/food,Mon Jan 15 2018 09:04:02 GMT-0800 (PST),Perspiciatis quo quia nobis ut illo nihil at sed hic.,25,false
61,10,http://lorempixel.com/640/480/food,Thu May 14 2015 11:07:32 GMT-0700 (PDT),Nihil tenetur voluptas perspiciatis voluptatem animi nulla voluptatem quia velit.,11,false
38,22,http://lorempixel.com/640/480/food,Wed Jul 11 2018 00:11:20 GMT-0700 (PDT),Ut nihil aut in iste sunt at sunt ducimus eum.,26,false
50,3,http://lorempixel.com/640/480/food,Mon Mar 03 2014 13:19:25 GMT-0800 (PST),Nulla aut provident sint laudantium non nobis sunt possimus et.,50,false
79,18,http://lorempixel.com/640/480/food,Mon Nov 16 2015 17:06:05 GMT-0800 (PST),Necessitatibus dignissimos placeat recusandae alias accusantium perferendis quaerat molestias sed.,44,false
1,27,http://lorempixel.com/640/480/food,Fri Apr 11 2014 13:26:44 GMT-0700 (PDT),Repellendus et reprehenderit iure sit aut sint voluptas laborum earum.,25,false
51,47,http://lorempixel.com/640/480/food,Tue May 29 2018 15:23:47 GMT-0700 (PDT),Recusandae tempora dolores vitae cupiditate occaecati adipisci quo minima sed.,43,false
20,31,http://lorempixel.com/640/480/food,Wed Jun 29 2016 01:25:52 GMT-0700 (PDT),Natus error deleniti voluptatem porro doloribus iure corporis sed enim.,11,false
71,33,http://lorempixel.com/640/480/food,Sun Apr 13 2014 00:10:52 GMT-0700 (PDT),Voluptates et quibusdam deserunt quas nostrum dolor aliquid nemo eos.,24,false
16,44,http://lorempixel.com/640/480/food,Tue Apr 08 2014 01:24:04 GMT-0700 (PDT),Ex eum laboriosam tempora laborum omnis alias hic ut sunt.,12,false
66,32,http://lorempixel.com/640/480/food,Wed Feb 26 2014 14:44:43 GMT-0800 (PST),Quae est sapiente quidem inventore et sed nobis aut laudantium.,26,false
41,23,http://lorempixel.com/640/480/food,Fri Jan 22 2016 17:04:10 GMT-0800 (PST),Molestiae tenetur officiis iste molestiae qui autem voluptates atque ut.,1,false
43,0,http://lorempixel.com/640/480/food,Sat May 17 2014 11:25:38 GMT-0700 (PDT),Possimus libero nihil rerum ex reprehenderit ut minima vel deserunt.,36,false
77,38,http://lorempixel.com/640/480/food,Sun Sep 17 2017 23:12:03 GMT-0700 (PDT),Fugit facere dicta beatae quam dolores corrupti est quia vitae.,15,false
30,10,http://lorempixel.com/640/480/food,Thu Sep 03 2015 06:42:26 GMT-0700 (PDT),Omnis et voluptates velit sapiente maxime ex sed quia in.,22,false
68,20,http://lorempixel.com/640/480/food,Thu Dec 11 2014 23:04:13 GMT-0800 (PST),Facilis ut impedit sit et asperiores sed mollitia maiores sed.,33,false
88,16,http://lorempixel.com/640/480/food,Sat Oct 03 2015 16:59:20 GMT-0700 (PDT),Harum quas voluptatem unde eum corrupti consequatur natus eum aliquam.,16,false
32,4,http://lorempixel.com/640/480/food,Sun Oct 29 2017 02:45:33 GMT-0700 (PDT),Asperiores dolor aliquam quia sit voluptates autem beatae minus rerum.,2,false
52,38,http://lorempixel.com/640/480/food,Wed Aug 12 2015 20:53:27 GMT-0700 (PDT),Est delectus pariatur iure quia mollitia optio ullam omnis minima.,20,false
94,18,http://lorempixel.com/640/480/food,Wed Jan 07 2015 21:54:58 GMT-0800 (PST),Laudantium omnis nihil culpa culpa ducimus necessitatibus magni voluptatem voluptas.,17,false
41,29,http://lorempixel.com/640/480/food,Fri Apr 27 2018 15:58:39 GMT-0700 (PDT),Aut impedit inventore blanditiis consequuntur eveniet id eum dolore blanditiis.,5,false
26,33,http://lorempixel.com/640/480/food,Wed May 25 2016 07:38:18 GMT-0700 (PDT),Voluptates voluptatem nostrum repellat quos non sed eum aut dolores.,43,false
30,25,http://lorempixel.com/640/480/food,Fri Nov 07 2014 17:20:11 GMT-0800 (PST),Dicta fugiat et quo qui neque consequuntur voluptatem adipisci assumenda.,47,false
79,1,http://lorempixel.com/640/480/food,Mon Aug 10 2015 01:10:28 GMT-0700 (PDT),Nesciunt mollitia et rerum tempora excepturi eos aut quod repellat.,9,false
40,14,http://lorempixel.com/640/480/food,Tue Dec 08 2015 10:51:28 GMT-0800 (PST),Omnis aut est id magni eligendi doloremque minus dignissimos iure.,8,false
3,45,http://lorempixel.com/640/480/food,Tue Feb 23 2016 09:02:51 GMT-0800 (PST),Autem nihil in labore rerum molestiae magni aut beatae odio.,7,false
93,38,http://lorempixel.com/640/480/food,Wed Aug 01 2018 17:55:02 GMT-0700 (PDT),Earum aspernatur maiores optio nemo voluptatem sed rerum rerum quia.,17,false
66,13,http://lorempixel.com/640/480/food,Mon Jan 13 2014 19:44:45 GMT-0800 (PST),Placeat ratione libero suscipit doloremque voluptatum velit commodi porro aliquam.,7,false
84,43,http://lorempixel.com/640/480/food,Mon Feb 06 2017 21:45:45 GMT-0800 (PST),Enim nisi rerum pariatur velit ut atque eum nostrum veritatis.,5,false
27,0,http://lorempixel.com/640/480/food,Mon Apr 16 2018 03:37:23 GMT-0700 (PDT),Perspiciatis rerum qui fuga accusantium et voluptates laudantium nostrum odit.,19,false
66,5,http://lorempixel.com/640/480/food,Fri Apr 01 2016 06:59:44 GMT-0700 (PDT),Distinctio rerum repellendus eum cupiditate quas qui aut et delectus.,42,false
53,22,http://lorempixel.com/640/480/food,Sun Jan 08 2017 02:07:34 GMT-0800 (PST),Corporis omnis odit hic sit quo autem ipsam porro minus.,1,false
77,12,http://lorempixel.com/640/480/food,Tue Jul 22 2014 20:15:12 GMT-0700 (PDT),Sint ea expedita magnam dolor voluptas dicta perferendis repudiandae aut.,45,false
35,47,http://lorempixel.com/640/480/food,Wed Nov 02 2016 00:34:05 GMT-0700 (PDT),Cupiditate doloribus ea provident ut autem eaque omnis aut officia.,6,false
44,2,http://lorempixel.com/640/480/food,Mon Nov 17 2014 15:11:48 GMT-0800 (PST),Fugiat dolores nostrum possimus nam sapiente labore ad quam dolorem.,43,false
59,43,http://lorempixel.com/640/480/food,Sat Feb 11 2017 06:21:19 GMT-0800 (PST),Ut qui nisi repellat dignissimos nihil tempore et quos itaque.,7,false
62,42,http://lorempixel.com/640/480/food,Wed Aug 15 2018 11:56:59 GMT-0700 (PDT),Consequuntur sit odit vel quas alias eligendi et laboriosam tempora.,22,false
99,23,http://lorempixel.com/640/480/food,Mon Jul 28 2014 16:59:59 GMT-0700 (PDT),Provident ut soluta alias reiciendis minima at qui officiis nisi.,12,false
32,9,http://lorempixel.com/640/480/food,Sun Aug 10 2014 11:50:10 GMT-0700 (PDT),Voluptatum architecto eaque ea et porro delectus sit est sapiente.,20,false
71,30,http://lorempixel.com/640/480/food,Wed Jan 10 2018 11:04:19 GMT-0800 (PST),Recusandae harum ducimus nam atque quos iure qui consequuntur quisquam.,10,false
55,31,http://lorempixel.com/640/480/food,Sat May 27 2017 11:15:45 GMT-0700 (PDT),Quos est ut consequuntur ut quia occaecati sint ab doloremque.,25,false
56,43,http://lorempixel.com/640/480/food,Wed Apr 26 2017 22:07:02 GMT-0700 (PDT),Eveniet rem magni temporibus est voluptas dolorem harum deleniti et.,14,false
67,38,http://lorempixel.com/640/480/food,Fri Nov 14 2014 03:45:52 GMT-0800 (PST),Molestiae et porro est omnis veritatis vitae corrupti voluptatibus exercitationem.,24,false
66,34,http://lorempixel.com/640/480/food,Sun Oct 05 2014 09:04:45 GMT-0700 (PDT),Commodi ea ex aut ipsa alias unde corrupti perspiciatis aut.,24,false
65,42,http://lorempixel.com/640/480/food,Fri Nov 17 2017 10:26:55 GMT-0800 (PST),Tempora rem asperiores sed consequatur sit nam illum hic iste.,18,false
6,32,http://lorempixel.com/640/480/food,Sun Sep 22 2013 01:10:16 GMT-0700 (PDT),Consequuntur voluptatum minus deserunt beatae ad dicta reprehenderit dolor est.,4,false
72,11,http://lorempixel.com/640/480/food,Fri Jan 01 2016 22:16:37 GMT-0800 (PST),Sit et explicabo perspiciatis neque aut voluptate expedita a est.,35,false
6,20,http://lorempixel.com/640/480/food,Thu May 15 2014 03:01:06 GMT-0700 (PDT),Est laudantium repudiandae id et aut odit voluptatibus dicta expedita.,35,false
82,36,http://lorempixel.com/640/480/food,Thu Jun 08 2017 07:10:48 GMT-0700 (PDT),Reprehenderit explicabo non eaque autem dolore ab architecto optio expedita.,5,false
11,33,http://lorempixel.com/640/480/food,Thu Jul 23 2015 13:24:59 GMT-0700 (PDT),Est est similique vel id consectetur saepe corporis ipsum nihil.,0,false
88,23,http://lorempixel.com/640/480/food,Wed May 28 2014 22:53:46 GMT-0700 (PDT),Laborum minus similique similique accusamus perspiciatis saepe nam soluta sint.,6,false
8,3,http://lorempixel.com/640/480/food,Fri Nov 04 2016 08:58:04 GMT-0700 (PDT),Provident earum dolor delectus autem minima ut necessitatibus iste perferendis.,48,false
51,41,http://lorempixel.com/640/480/food,Tue Nov 15 2016 08:44:59 GMT-0800 (PST),Repudiandae mollitia aut voluptatem et ut sint a animi quidem.,50,false
25,11,http://lorempixel.com/640/480/food,Sun Jun 15 2014 17:20:20 GMT-0700 (PDT),Et beatae sunt rerum facilis sint expedita rerum ut impedit.,28,false
37,29,http://lorempixel.com/640/480/food,Sat Nov 07 2015 08:22:10 GMT-0800 (PST),Facilis qui provident dolorem id quia illum voluptatem quidem ducimus.,47,false
28,0,http://lorempixel.com/640/480/food,Thu May 07 2015 07:11:43 GMT-0700 (PDT),Aspernatur ut est ut nulla animi sit nostrum cupiditate officia.,40,false
92,33,http://lorempixel.com/640/480/food,Fri Oct 28 2016 03:00:40 GMT-0700 (PDT),Ut sit inventore et et tenetur ex illum quas tempore.,30,false
86,37,http://lorempixel.com/640/480/food,Mon Feb 09 2015 14:20:33 GMT-0800 (PST),Tempore ipsum est eligendi labore omnis provident quia mollitia doloremque.,18,false
29,22,http://lorempixel.com/640/480/food,Thu Jan 02 2014 15:52:25 GMT-0800 (PST),Eum corrupti quae quibusdam et deserunt et quam omnis illum.,5,false
32,38,http://lorempixel.com/640/480/food,Wed Oct 21 2015 17:47:28 GMT-0700 (PDT),Dolores eos sed voluptatem omnis soluta placeat et neque beatae.,26,false
22,21,http://lorempixel.com/640/480/food,Mon May 18 2015 22:34:23 GMT-0700 (PDT),Veritatis fugit ex quisquam aut illum voluptas molestias modi animi.,49,false
98,18,http://lorempixel.com/640/480/food,Mon Jul 10 2017 15:20:54 GMT-0700 (PDT),Aliquam sapiente sit sit magnam a iste esse suscipit odio.,21,false
60,42,http://lorempixel.com/640/480/food,Mon Apr 04 2016 06:40:05 GMT-0700 (PDT),Optio et incidunt quaerat dolores quod animi occaecati ipsum minima.,10,false
32,15,http://lorempixel.com/640/480/food,Sun Dec 03 2017 19:12:25 GMT-0800 (PST),Sapiente ut dolores consectetur laboriosam qui odio ex rerum necessitatibus.,14,false
72,48,http://lorempixel.com/640/480/food,Fri Jul 21 2017 04:27:18 GMT-0700 (PDT),Consequatur non ea soluta eum odit ipsum nemo voluptate nulla.,50,false
59,47,http://lorempixel.com/640/480/food,Mon Jan 25 2016 09:12:32 GMT-0800 (PST),Voluptatem voluptate maxime velit ut mollitia sequi qui magnam praesentium.,19,false
91,30,http://lorempixel.com/640/480/food,Thu Sep 03 2015 18:20:44 GMT-0700 (PDT),Vel adipisci quos dolores voluptatem mollitia in quam eum debitis.,1,false
37,4,http://lorempixel.com/640/480/food,Mon Aug 25 2014 13:26:31 GMT-0700 (PDT),Illo voluptatum aut minus aut eum quidem et rerum maiores.,20,false
22,16,http://lorempixel.com/640/480/food,Sat Aug 22 2015 20:45:14 GMT-0700 (PDT),Incidunt dolore quaerat aliquam perspiciatis repellendus dolor alias aperiam est.,39,false
82,48,http://lorempixel.com/640/480/food,Tue Dec 03 2013 00:24:10 GMT-0800 (PST),Excepturi amet voluptas sed voluptatem minus velit nesciunt eligendi ab.,27,false
80,32,http://lorempixel.com/640/480/food,Thu Oct 17 2013 09:33:19 GMT-0700 (PDT),Ut ea dolores tenetur dolor velit est ducimus voluptatem tempore.,24,false
34,46,http://lorempixel.com/640/480/food,Sun May 25 2014 02:13:42 GMT-0700 (PDT),Eaque quo quia sit quam labore eveniet blanditiis optio corporis.,30,false
47,49,http://lorempixel.com/640/480/food,Sun May 22 2016 13:53:33 GMT-0700 (PDT),Tenetur hic labore non temporibus perspiciatis blanditiis nihil maiores sed.,5,false
44,4,http://lorempixel.com/640/480/food,Thu Feb 23 2017 05:32:53 GMT-0800 (PST),Quibusdam hic similique non sunt quia quia assumenda voluptas voluptas.,3,false
76,45,http://lorempixel.com/640/480/food,Sat Oct 15 2016 17:27:37 GMT-0700 (PDT),Magni aspernatur ut voluptates aut magni fugiat ea enim sed.,5,false
89,34,http://lorempixel.com/640/480/food,Sun Jan 04 2015 09:30:13 GMT-0800 (PST),Veniam aut sed dolore cum distinctio nulla corporis et aut.,22,false
81,9,http://lorempixel.com/640/480/food,Fri Aug 03 2018 18:23:57 GMT-0700 (PDT),Error cumque non sed a ut voluptas optio eligendi ut.,50,false
53,48,http://lorempixel.com/640/480/food,Sun Feb 21 2016 19:38:59 GMT-0800 (PST),Unde neque consectetur praesentium provident consequatur illo perspiciatis dolor amet.,46,false
90,7,http://lorempixel.com/640/480/food,Thu Feb 22 2018 06:45:37 GMT-0800 (PST),Doloribus enim corporis ratione est ut dicta vero accusamus recusandae.,38,false
28,8,http://lorempixel.com/640/480/food,Wed Aug 17 2016 12:04:06 GMT-0700 (PDT),Maxime quis magni perferendis qui est nisi repellendus fugit officia.,15,false
80,20,http://lorempixel.com/640/480/food,Thu Dec 28 2017 15:28:43 GMT-0800 (PST),Dolores hic et repudiandae quia et animi in nesciunt deserunt.,29,false
52,25,http://lorempixel.com/640/480/food,Tue Nov 05 2013 06:56:18 GMT-0800 (PST),Est delectus molestiae neque et fugiat quis libero commodi adipisci.,50,false
53,32,http://lorempixel.com/640/480/food,Fri Mar 25 2016 21:43:28 GMT-0700 (PDT),Dignissimos rerum non nostrum culpa consequatur ad inventore perspiciatis dolores.,33,false
23,24,http://lorempixel.com/640/480/food,Mon Jul 21 2014 00:06:01 GMT-0700 (PDT),Consequatur deserunt distinctio ab rem culpa placeat dolores omnis iste.,12,false
78,29,http://lorempixel.com/640/480/food,Fri Mar 14 2014 05:14:50 GMT-0700 (PDT),Animi voluptatibus dolorem natus molestiae aut quos tempora explicabo magnam.,20,false
31,17,http://lorempixel.com/640/480/food,Sun Dec 06 2015 13:06:48 GMT-0800 (PST),Numquam est et et nam rerum rem quaerat repellendus ut.,33,false
29,15,http://lorempixel.com/640/480/food,Thu Sep 26 2013 18:29:31 GMT-0700 (PDT),Est iste nobis soluta accusantium consequatur quod aliquam suscipit dolore.,27,false
24,12,http://lorempixel.com/640/480/food,Thu Jul 23 2015 13:04:55 GMT-0700 (PDT),Tempore dicta laboriosam repudiandae nisi corrupti provident animi sed ut.,4,false
49,22,http://lorempixel.com/640/480/food,Thu Jan 19 2017 03:10:04 GMT-0800 (PST),Harum quia consequatur officiis culpa eaque tempore nihil quia consequatur.,45,false
42,28,http://lorempixel.com/640/480/food,Sun Aug 12 2018 07:55:05 GMT-0700 (PDT),Id ut repellendus deserunt dolore qui deleniti eius quis sed.,3,false
38,49,http://lorempixel.com/640/480/food,Sat Apr 25 2015 09:54:55 GMT-0700 (PDT),Molestiae ipsam commodi enim placeat libero ut modi et illum.,34,false
33,15,http://lorempixel.com/640/480/food,Sat Jun 04 2016 17:15:56 GMT-0700 (PDT),Rerum excepturi ipsa quia voluptas est sed vitae aliquam autem.,10,false
22,13,http://lorempixel.com/640/480/food,Thu Jul 23 2015 01:23:34 GMT-0700 (PDT),Nobis facilis quidem dignissimos quia est maiores et atque labore.,27,false
81,44,http://lorempixel.com/640/480/food,Tue Oct 25 2016 02:52:50 GMT-0700 (PDT),Quo magni provident asperiores eos odio nihil rerum sunt harum.,5,false
17,44,http://lorempixel.com/640/480/food,Mon Aug 01 2016 21:34:17 GMT-0700 (PDT),Velit libero dolore iste sint perspiciatis voluptas voluptatem porro ullam.,3,false
43,20,http://lorempixel.com/640/480/food,Thu Oct 10 2013 16:22:57 GMT-0700 (PDT),Iure ut quidem veritatis incidunt earum quaerat minima dolores et.,36,false
26,3,http://lorempixel.com/640/480/food,Mon Jul 02 2018 17:00:53 GMT-0700 (PDT),Consequuntur deleniti officia saepe et nesciunt reprehenderit distinctio blanditiis enim.,13,false
79,42,http://lorempixel.com/640/480/food,Wed Jul 04 2018 23:26:53 GMT-0700 (PDT),Vel quibusdam illo cum nesciunt sed vel qui sequi quas.,42,false
11,26,http://lorempixel.com/640/480/food,Wed Feb 17 2016 04:11:08 GMT-0800 (PST),Tenetur quisquam et in error nihil officiis aut autem quidem.,32,false
29,50,http://lorempixel.com/640/480/food,Sun Feb 07 2016 12:29:33 GMT-0800 (PST),Tempore et non repellat sed excepturi officia eum veritatis sit.,7,false
52,31,http://lorempixel.com/640/480/food,Mon Dec 15 2014 02:19:19 GMT-0800 (PST),Quia quidem dolores nemo placeat omnis non totam eligendi ut.,46,false
41,46,http://lorempixel.com/640/480/food,Thu Oct 12 2017 11:22:35 GMT-0700 (PDT),Qui necessitatibus nesciunt temporibus tempore eum totam necessitatibus rerum praesentium.,10,false
34,40,http://lorempixel.com/640/480/food,Thu Jul 30 2015 04:34:54 GMT-0700 (PDT),Qui sunt eaque consequatur ullam fugit est quod nihil atque.,39,false
73,27,http://lorempixel.com/640/480/food,Sun May 04 2014 17:07:28 GMT-0700 (PDT),Quos a non recusandae molestiae accusamus qui voluptates eos aperiam.,34,false
21,8,http://lorempixel.com/640/480/food,Sun Jun 25 2017 05:15:39 GMT-0700 (PDT),Natus aliquam ea molestias laudantium officiis occaecati eius nam quisquam.,35,false
77,39,http://lorempixel.com/640/480/food,Wed Dec 18 2013 04:13:16 GMT-0800 (PST),Molestias est occaecati qui id natus et qui aliquam dolores.,50,false
52,20,http://lorempixel.com/640/480/food,Sat Feb 22 2014 01:02:00 GMT-0800 (PST),Asperiores tempore ducimus odit esse voluptates expedita quas aut sit.,6,false
7,50,http://lorempixel.com/640/480/food,Thu Jul 07 2016 08:04:05 GMT-0700 (PDT),Harum distinctio non voluptate nihil qui rerum corrupti dolorem possimus.,30,false
55,4,http://lorempixel.com/640/480/food,Tue Sep 26 2017 21:26:59 GMT-0700 (PDT),Aut deserunt et excepturi fugit ut culpa magni ipsum deleniti.,45,false
66,20,http://lorempixel.com/640/480/food,Wed Jan 03 2018 10:46:20 GMT-0800 (PST),Et iure et sunt ut neque at et dicta earum.,44,false
98,43,http://lorempixel.com/640/480/food,Tue Dec 13 2016 12:39:09 GMT-0800 (PST),Qui velit est quibusdam libero minus sint sapiente sunt dolores.,8,false
26,50,http://lorempixel.com/640/480/food,Fri Dec 18 2015 10:14:38 GMT-0800 (PST),Temporibus amet eum officiis et laboriosam recusandae quidem assumenda eos.,47,false
50,40,http://lorempixel.com/640/480/food,Sat Feb 24 2018 19:50:22 GMT-0800 (PST),Sed et aliquid aut debitis pariatur quia repudiandae illo quia.,24,false
55,42,http://lorempixel.com/640/480/food,Mon Oct 10 2016 05:32:37 GMT-0700 (PDT),Qui animi vel itaque illum sunt blanditiis animi aperiam recusandae.,29,false
3,5,http://lorempixel.com/640/480/food,Thu Dec 14 2017 04:11:50 GMT-0800 (PST),Aut ea nemo perspiciatis architecto natus voluptas tempora non officia.,13,false
1,34,http://lorempixel.com/640/480/food,Fri Oct 16 2015 01:26:14 GMT-0700 (PDT),Consequatur aliquid animi ut natus autem nihil a qui totam.,23,false
41,12,http://lorempixel.com/640/480/food,Wed Dec 06 2017 22:42:17 GMT-0800 (PST),Dolores temporibus impedit consequatur amet dolores vero quis repudiandae et.,30,false
15,20,http://lorempixel.com/640/480/food,Tue Jan 20 2015 02:12:02 GMT-0800 (PST),Dolor at et expedita dignissimos quia esse hic nulla ipsam.,9,false
16,4,http://lorempixel.com/640/480/food,Tue Nov 22 2016 14:49:19 GMT-0800 (PST),A et numquam pariatur alias a quia odit rerum et.,35,false
6,38,http://lorempixel.com/640/480/food,Tue Aug 21 2018 22:02:15 GMT-0700 (PDT),Neque ducimus vel nulla sed tempore earum tempore et aut.,22,false
42,45,http://lorempixel.com/640/480/food,Fri Nov 01 2013 13:49:51 GMT-0700 (PDT),Aliquam doloremque explicabo saepe quod aut porro ipsa vero minus.,19,false
29,29,http://lorempixel.com/640/480/food,Mon Feb 29 2016 18:42:30 GMT-0800 (PST),Et dolores debitis voluptas vero dolore odio repellat corporis aspernatur.,31,false
79,25,http://lorempixel.com/640/480/food,Mon Nov 03 2014 14:26:10 GMT-0800 (PST),Accusamus aspernatur et occaecati architecto sed qui voluptate voluptas est.,22,false
48,22,http://lorempixel.com/640/480/food,Mon Jun 08 2015 05:19:50 GMT-0700 (PDT),Illum exercitationem nam deserunt iure eum molestiae voluptas quo consequatur.,18,false
83,17,http://lorempixel.com/640/480/food,Tue May 01 2018 01:03:28 GMT-0700 (PDT),Veritatis autem vel labore velit provident doloremque incidunt labore qui.,50,false
77,39,http://lorempixel.com/640/480/food,Wed Mar 12 2014 03:13:05 GMT-0700 (PDT),Aliquam quibusdam ipsa est harum a eaque nostrum ipsa sapiente.,32,false
79,5,http://lorempixel.com/640/480/food,Fri Aug 19 2016 10:26:58 GMT-0700 (PDT),Et sed quam quam in eligendi magnam eos aliquam et.,21,false
5,21,http://lorempixel.com/640/480/food,Tue Jul 07 2015 11:00:27 GMT-0700 (PDT),Expedita voluptatibus iure dolor quisquam et eligendi dolores quia ex.,44,false
48,20,http://lorempixel.com/640/480/food,Thu Aug 28 2014 23:55:57 GMT-0700 (PDT),Velit fuga sequi et quia neque ut non nostrum velit.,39,false
63,25,http://lorempixel.com/640/480/food,Sun Mar 05 2017 03:41:28 GMT-0800 (PST),Ut culpa modi natus ab qui consequatur dolorem ut ut.,0,false
7,11,http://lorempixel.com/640/480/food,Tue Aug 16 2016 05:48:23 GMT-0700 (PDT),Vitae qui ex quam laborum ipsum dolores reprehenderit perferendis qui.,15,false
15,7,http://lorempixel.com/640/480/food,Sat May 19 2018 17:22:30 GMT-0700 (PDT),Eum fuga deserunt in ut eveniet ut ut deleniti iusto.,25,false
34,11,http://lorempixel.com/640/480/food,Fri Nov 07 2014 18:48:34 GMT-0800 (PST),Consequatur eaque laboriosam aut sed quibusdam distinctio nam quia quo.,12,false
96,40,http://lorempixel.com/640/480/food,Thu Mar 05 2015 22:13:53 GMT-0800 (PST),Nesciunt dolorem debitis tempore sapiente voluptatem aut dicta ipsum dignissimos.,21,false
77,50,http://lorempixel.com/640/480/food,Mon Jul 16 2018 04:22:12 GMT-0700 (PDT),Labore quis in veniam vel architecto est atque aspernatur et.,20,false
87,25,http://lorempixel.com/640/480/food,Sat Dec 27 2014 14:10:52 GMT-0800 (PST),Tempore animi dolores natus eum iure esse voluptas exercitationem iste.,47,false
5,42,http://lorempixel.com/640/480/food,Sun Aug 14 2016 04:57:25 GMT-0700 (PDT),Officia voluptatibus optio dolorum sit dignissimos eum laudantium commodi repellendus.,20,false
52,20,http://lorempixel.com/640/480/food,Tue Jul 14 2015 16:05:35 GMT-0700 (PDT),Sit non fugit ipsum dolorem est ut iusto vel eligendi.,9,false
58,48,http://lorempixel.com/640/480/food,Sun Dec 03 2017 18:50:33 GMT-0800 (PST),Laudantium quidem et vel explicabo et at doloremque nihil et.,36,false
7,28,http://lorempixel.com/640/480/food,Sun Nov 03 2013 06:50:03 GMT-0800 (PST),Voluptas voluptatibus a non aperiam cum asperiores nulla eveniet deserunt.,8,false
67,3,http://lorempixel.com/640/480/food,Mon Apr 03 2017 05:07:22 GMT-0700 (PDT),Repudiandae nihil quia iste libero qui quidem sed officiis nihil.,3,false
26,44,http://lorempixel.com/640/480/food,Sat Jun 06 2015 23:30:00 GMT-0700 (PDT),Excepturi et hic est sapiente et quas fugit omnis voluptas.,29,false
15,48,http://lorempixel.com/640/480/food,Sat Jul 14 2018 00:20:44 GMT-0700 (PDT),Placeat saepe beatae aut vitae fuga vel voluptas asperiores omnis.,45,false
72,0,http://lorempixel.com/640/480/food,Tue Feb 11 2014 23:45:32 GMT-0800 (PST),Commodi non qui culpa qui qui ex porro quod delectus.,24,false
0,6,http://lorempixel.com/640/480/food,Mon Jan 27 2014 12:15:09 GMT-0800 (PST),Omnis sed sint quibusdam sit natus maxime consequatur non rerum.,19,false
0,47,http://lorempixel.com/640/480/food,Wed Sep 06 2017 00:38:39 GMT-0700 (PDT),Incidunt sed laborum consectetur aut in optio et quia sint.,50,false
8,20,http://lorempixel.com/640/480/food,Wed Jun 13 2018 22:25:27 GMT-0700 (PDT),Pariatur aliquid numquam sint molestiae est sint commodi explicabo et.,45,false
73,48,http://lorempixel.com/640/480/food,Sun Nov 12 2017 00:46:02 GMT-0800 (PST),Veritatis ullam voluptas et voluptas dolorum quis et necessitatibus soluta.,13,false
23,44,http://lorempixel.com/640/480/food,Mon Jan 06 2014 00:37:02 GMT-0800 (PST),Harum sapiente excepturi delectus laudantium nam tenetur nihil beatae consequatur.,22,false
39,44,http://lorempixel.com/640/480/food,Sat Dec 27 2014 09:52:03 GMT-0800 (PST),Id beatae repellat recusandae sequi ducimus magnam sequi odio quaerat.,46,false
82,24,http://lorempixel.com/640/480/food,Tue May 22 2018 23:04:02 GMT-0700 (PDT),A voluptatem eius voluptatem non blanditiis distinctio atque aliquam quidem.,28,false
