businessId,imageUploaderId,imageUrl,imageUploadDate,imageComment,helpfulCount,reported
94,17,http://lorempixel.com/640/480/food,Fri Aug 24 2018 04:32:29 GMT-0700 (PDT),Voluptas ut qui placeat eveniet recusandae consequatur qui ducimus excepturi.,21,false
58,39,http://lorempixel.com/640/480/food,Sat Jul 16 2016 03:01:54 GMT-0700 (PDT),Officiis ut ex laudantium adipisci laboriosam aut asperiores officiis in.,34,false
50,25,http://lorempixel.com/640/480/food,Mon May 30 2016 22:10:02 GMT-0700 (PDT),Aut aut blanditiis magni facilis ea quo vero ut commodi.,25,false
82,1,http://lorempixel.com/640/480/food,Sat Feb 21 2015 16:15:11 GMT-0800 (PST),Enim doloribus cum doloribus earum labore quo corporis sapiente dolores.,28,false
66,23,http://lorempixel.com/640/480/food,Sun Aug 24 2014 10:00:14 GMT-0700 (PDT),Deleniti est est saepe fugiat qui natus repellendus qui quaerat.,44,false
34,40,http://lorempixel.com/640/480/food,Wed Jan 25 2017 07:34:21 GMT-0800 (PST),Exercitationem nihil magnam a placeat illum quo eos aut aliquid.,6,false
3,12,http://lorempixel.com/640/480/food,Sat May 24 2014 00:58:40 GMT-0700 (PDT),Et sed est minima qui esse ut rem corporis voluptatibus.,23,false
37,46,http://lorempixel.com/640/480/food,Tue Nov 19 2013 04:03:23 GMT-0800 (PST),Ad quisquam itaque quos est iste molestiae sit in nulla.,34,false
95,48,http://lorempixel.com/640/480/food,Tue Apr 26 2016 22:35:48 GMT-0700 (PDT),Architecto eaque et eligendi repellat totam odit maiores qui et.,24,false
22,7,http://lorempixel.com/640/480/food,Thu Oct 06 2016 11:38:25 GMT-0700 (PDT),Aut molestias nam omnis molestias quia commodi nemo quia rerum.,50,false
93,15,http://lorempixel.com/640/480/food,Sat Jun 09 2018 02:35:33 GMT-0700 (PDT),Doloremque ea rerum rerum nihil et quo eos assumenda est.,46,false
88,23,http://lorempixel.com/640/480/food,Sun Sep 25 2016 14:42:04 GMT-0700 (PDT),Illo consequuntur sint cumque rerum voluptates ea sunt aut ut.,48,false
36,45,http://lorempixel.com/640/480/food,Sat May 28 2016 00:29:15 GMT-0700 (PDT),Delectus ab nostrum dolores velit hic hic tempora accusantium praesentium.,14,false
94,3,http://lorempixel.com/640/480/food,Sat Oct 25 2014 17:04:35 GMT-0700 (PDT),Hic aliquam consequatur aut quis dolorum totam sequi unde possimus.,15,false
35,10,http://lorempixel.com/640/480/food,Sun May 11 2014 03:12:51 GMT-0700 (PDT),Consequatur eum voluptatem esse omnis magni tempora qui minima aspernatur.,48,false
75,22,http://lorempixel.com/640/480/food,Thu Apr 21 2016 20:45:47 GMT-0700 (PDT),Quo similique dolor veniam expedita ab aperiam quo enim nemo.,26,false
74,2,http://lorempixel.com/640/480/food,Tue Jan 14 2014 10:13:10 GMT-0800 (PST),Quam veritatis aspernatur quam fuga id quis quisquam non eveniet.,40,false
36,40,http://lorempixel.com/640/480/food,Mon Apr 18 2016 18:40:10 GMT-0700 (PDT),Eos enim qui aliquam doloremque molestiae nulla occaecati illum voluptatem.,11,false
30,3,http://lorempixel.com/640/480/food,Tue Jun 28 2016 04:15:45 GMT-0700 (PDT),Et ipsa quo ut nisi debitis voluptatem quos delectus quis.,43,false
87,4,http://lorempixel.com/640/480/food,Thu Dec 26 2013 13:34:06 GMT-0800 (PST),Quis consequatur at rerum ipsum voluptates possimus qui nobis voluptatem.,35,false
76,22,http://lorempixel.com/640/480/food,Sat Jul 29 2017 16:43:23 GMT-0700 (PDT),Ipsam sint minus est eveniet accusantium et ea quaerat sit.,1,false
23,24,http://lorempixel.com/640/480/food,Sun Jun 18 2017 03:52:02 GMT-0700 (PDT),Dolorem ducimus eos hic quia sit officiis a veritatis asperiores.,46,false
86,32,http://lorempixel.com/640/480/food,Wed May 27 2015 08:35:43 GMT-0700 (PDT),Provident culpa eius quo occaecati minus natus architecto numquam consectetur.,16,false
71,14,http://lorempixel.com/640/480/food,Mon Jul 04 2016 23:44:45 GMT-0700 (PDT),Aut delectus sed ab sunt omnis quae cupiditate exercitationem sed.,36,false
27,25,http://lorempixel.com/640/480/food,Sat Jan 06 2018 06:05:53 GMT-0800 (PST),Laboriosam veniam quasi quasi qui blanditiis ut sint quos quo.,0,false
29,39,http://lorempixel.com/640/480/food,Thu Jan 05 2017 07:53:22 GMT-0800 (PST),Laudantium architecto aut voluptate omnis rem distinctio nam quia aut.,31,false
72,27,http://lorempixel.com/640/480/food,Tue Oct 18 2016 00:53:41 GMT-0700 (PDT),At eos accusamus accusamus est maxime hic repellendus facere cupiditate.,13,false
6,33,http://lorempixel.com/640/480/food,Sun Dec 03 2017 10:23:02 GMT-0800 (PST),Harum praesentium in id voluptatum iste molestiae est doloribus molestiae.,49,false
29,8,http://lorempixel.com/640/480/food,Wed Jul 08 2015 12:25:22 GMT-0700 (PDT),Omnis vero saepe aut est molestiae optio sunt in autem.,38,false
74,46,http://lorempixel.com/640/480/food,Sat Jun 04 2016 09:42:57 GMT-0700 (PDT),Rerum voluptatem cupiditate est sit dolor quia rerum excepturi repellendus.,26,false
28,25,http://lorempixel.com/640/480/food,Thu Jun 18 2015 11:40:56 GMT-0700 (PDT),Nobis nulla dolor animi culpa autem odit dolores sunt voluptatibus.,45,false
13,46,http://lorempixel.com/640/480/food,Sun Sep 04 2016 04:05:41 GMT-0700 (PDT),Aut non ab iste commodi inventore qui et tempore eum.,12,false
25,3,http://lorempixel.com/640/480/food,Sat Feb 27 2016 09:02:40 GMT-0800 (PST),Iusto tenetur non eum vitae molestiae dicta a ex nihil.,50,false
100,6,http://lorempixel.com/640/480/food,Fri Nov 27 2015 22:26:40 GMT-0800 (PST),Voluptatem nam quaerat voluptatibus rerum velit aut reiciendis magni molestiae.,23,false
56,8,http://lorempixel.com/640/480/food,Sun Dec 21 2014 04:55:48 GMT-0800 (PST),Veritatis voluptatem quia velit eligendi neque nulla magnam itaque voluptate.,2,false
93,2,http://lorempixel.com/640/480/food,Mon Dec 22 2014 08:11:42 GMT-0800 (PST),Ducimus doloremque et voluptate tempore quibusdam qui quis veritatis voluptatum.,44,false
45,37,http://lorempixel.com/640/480/food,Sat Sep 14 2013 20:24:16 GMT-0700 (PDT),Omnis saepe molestiae illo pariatur et qui aut sit cupiditate.,15,false
60,2,http://lorempixel.com/640/480/food,Wed Mar 12 2014 00:21:31 GMT-0700 (PDT),Cum numquam voluptatem nemo aspernatur illum in maxime laudantium qui.,0,false
60,42,http://lorempixel.com/640/480/food,Sun Mar 11 2018 21:28:01 GMT-0700 (PDT),Aspernatur accusantium sit alias qui est perferendis et aut vel.,12,false
3,36,http://lorempixel.com/640/480/food,Sun Sep 28 2014 07:22:47 GMT-0700 (PDT),Iusto odit natus praesentium et odit voluptas quidem eveniet distinctio.,12,false
60,19,http://lorempixel.com/640/480/food,Thu Oct 16 2014 12:14:03 GMT-0700 (PDT),Deleniti voluptates deserunt consequatur rerum id voluptatem velit est nulla.,15,false
3,26,http://lorempixel.com/640/480/food,Fri Dec 16 2016 05:26:09 GMT-0800 (PST),Molestiae repellat dolorem alias tenetur delectus dolores cupiditate sed non.,49,false
12,1,http://lorempixel.com/640/480/food,Mon Feb 17 2014 17:21:14 GMT-0800 (PST),Sed dolores dolor porro mollitia perferendis et ut quidem quasi.,46,false
70,0,http://lorempixel.com/640/480/food,Tue Feb 14 2017 06:39:07 GMT-0800 (PST),Qui illo dolores aut cumque qui aperiam perferendis debitis dolorem.,49,false
68,30,http://lorempixel.com/640/480/food,Tue Dec 31 2013 14:58:15 GMT-0800 (PST),Quod modi inventore architecto omnis quia est veritatis voluptatem vel.,35,false
53,8,http://lorempixel.com/640/480/food,Wed Dec 20 2017 13:53:46 GMT-0800 (PST),In qui et sit quam asperiores ea quaerat officia explicabo.,36,false
76,8,http://lorempixel.com/640/480/food,Fri Jun 10 2016 08:46:59 GMT-0700 (PDT),Consequuntur et nulla recusandae illo numquam laborum minus voluptatum aut.,40,false
31,15,http://lorempixel.com/640/480/food,Thu Sep 28 2017 07:24:59 GMT-0700 (PDT),Temporibus sapiente autem maxime ut voluptatem aut veniam doloribus laudantium.,10,false
8,18,http://lorempixel.com/640/480/food,Thu Dec 24 2015 10:43:47 GMT-0800 (PST),Molestiae tempora molestiae neque doloribus ipsum illum tempora esse quasi.,30,false
68,49,http://lorempixel.com/640/480/food,Mon Oct 03 2016 23:41:02 GMT-0700 (PDT),Modi dolor quibusdam labore temporibus tempore consequatur fuga at est.,6,false
32,11,http://lorempixel.com/640/480/food,Sat Apr 15 2017 21:46:45 GMT-0700 (PDT),Autem ipsum veniam asperiores praesentium unde deleniti voluptates laborum aliquid.,27,false
6,45,http://lorempixel.com/640/480/food,Sun Nov 13 2016 09:02:30 GMT-0800 (PST),Ullam necessitatibus est nemo itaque atque et reiciendis repudiandae sit.,9,false
40,39,http://lorempixel.com/640/480/food,Thu Jul 03 2014 01:15:38 GMT-0700 (PDT),Est adipisci omnis doloribus quisquam repellendus maxime placeat ut qui.,42,false
9,49,http://lorempixel.com/640/480/food,Sun Jun 21 2015 10:13:40 GMT-0700 (PDT),Excepturi impedit dolorem et consequatur alias laudantium ipsa qui eos.,50,false
39,45,http://lorempixel.com/640/480/food,Sat Oct 26 2013 16:58:43 GMT-0700 (PDT),Quo voluptatibus deleniti dolor omnis aperiam qui ducimus qui vero.,14,false
36,49,http://lorempixel.com/640/480/food,Thu Apr 09 2015 11:33:54 GMT-0700 (PDT),Sint tempora molestiae repudiandae natus blanditiis impedit est molestiae labore.,38,false
39,3,http://lorempixel.com/640/480/food,Wed Jan 17 2018 15:47:03 GMT-0800 (PST),Veniam consequatur non voluptatem illum maxime ut soluta quisquam dolorem.,2,false
33,30,http://lorempixel.com/640/480/food,Mon Sep 08 2014 05:29:32 GMT-0700 (PDT),Cupiditate harum voluptas atque autem distinctio explicabo et vitae laborum.,23,false
77,12,http://lorempixel.com/640/480/food,Sun Sep 07 2014 21:09:45 GMT-0700 (PDT),Voluptatem odit omnis perferendis dolorum odio illo sed veniam laudantium.,42,false
9,27,http://lorempixel.com/640/480/food,Thu Apr 19 2018 20:57:48 GMT-0700 (PDT),Ut molestiae aut optio similique vitae quisquam dolor sit delectus.,29,false
45,26,http://lorempixel.com/640/480/food,Sat May 02 2015 23:57:52 GMT-0700 (PDT),Beatae ex numquam molestias possimus temporibus asperiores accusamus eum id.,28,false
27,9,http://lorempixel.com/640/480/food,Mon Oct 30 2017 06:03:46 GMT-0700 (PDT),Non non exercitationem excepturi est pariatur possimus asperiores quia occaecati.,23,false
58,22,http://lorempixel.com/640/480/food,Sat Sep 24 2016 17:06:55 GMT-0700 (PDT),Quaerat quibusdam modi dolor sapiente earum rem et natus numquam.,40,false
85,1,http://lorempixel.com/640/480/food,Sun Jun 07 2015 20:03:35 GMT-0700 (PDT),Nobis quo iure sit aut autem rerum et qui rerum.,31,false
72,38,http://lorempixel.com/640/480/food,Thu Nov 23 2017 12:16:18 GMT-0800 (PST),Et veniam odio aut tempore reprehenderit iure commodi aut ad.,44,false
100,41,http://lorempixel.com/640/480/food,Fri Jun 24 2016 11:59:08 GMT-0700 (PDT),Consequatur eveniet quia totam alias similique commodi soluta consectetur deleniti.,32,false
21,39,http://lorempixel.com/640/480/food,Thu Sep 22 2016 17:41:11 GMT-0700 (PDT),Eum adipisci culpa et ut modi voluptatibus numquam repellendus similique.,41,false
4,1,http://lorempixel.com/640/480/food,Mon Dec 23 2013 09:38:24 GMT-0800 (PST),Repellat aliquam vel voluptatibus autem consequatur atque omnis culpa magni.,44,false
42,32,http://lorempixel.com/640/480/food,Mon May 01 2017 02:03:05 GMT-0700 (PDT),Occaecati doloremque reprehenderit eligendi est aut sit voluptatum ut ut.,50,false
82,4,http://lorempixel.com/640/480/food,Thu Mar 13 2014 21:13:33 GMT-0700 (PDT),Maxime quidem minima aut doloremque sunt qui aperiam ut illo.,10,false
61,49,http://lorempixel.com/640/480/food,Thu Oct 19 2017 21:14:39 GMT-0700 (PDT),Vero quis labore pariatur quas velit qui blanditiis totam incidunt.,5,false
72,1,http://lorempixel.com/640/480/food,Thu Sep 22 2016 17:06:18 GMT-0700 (PDT),Eveniet veritatis eos eius necessitatibus culpa cumque veniam provident quaerat.,27,false
72,37,http://lorempixel.com/640/480/food,Fri Jun 03 2016 15:03:52 GMT-0700 (PDT),Earum corrupti dolorem alias eius qui nobis tempore facere esse.,3,false
13,3,http://lorempixel.com/640/480/food,Sat Oct 24 2015 06:21:21 GMT-0700 (PDT),Officiis deleniti possimus aut voluptas id qui ullam tenetur facere.,7,false
24,3,http://lorempixel.com/640/480/food,Thu Apr 06 2017 01:09:56 GMT-0700 (PDT),Repellendus quidem voluptatem autem quia nulla ducimus quisquam necessitatibus dolor.,32,false
52,35,http://lorempixel.com/640/480/food,Sun Apr 20 2014 03:36:28 GMT-0700 (PDT),Magni occaecati recusandae nesciunt aut tempora ducimus animi qui sit.,34,false
12,8,http://lorempixel.com/640/480/food,Thu May 14 2015 07:40:07 GMT-0700 (PDT),Nihil expedita ipsa quia nihil a quia recusandae in numquam.,22,false
72,8,http://lorempixel.com/640/480/food,Mon Sep 18 2017 21:38:07 GMT-0700 (PDT),Et aperiam saepe rerum eum et iste dolorum animi ipsam.,17,false
0,3,http://lorempixel.com/640/480/food,Mon Sep 01 2014 16:29:43 GMT-0700 (PDT),Exercitationem ut et iusto non harum vitae voluptatem quae quisquam.,19,false
23,35,http://lorempixel.com/640/480/food,Thu Sep 26 2013 06:47:04 GMT-0700 (PDT),Quidem non dignissimos quos corrupti distinctio quasi est dicta corporis.,15,false
13,27,http://lorempixel.com/640/480/food,Sat Oct 18 2014 17:05:53 GMT-0700 (PDT),Et ullam dolore nemo molestiae ut nam libero sint et.,40,false
65,20,http://lorempixel.com/640/480/food,Sun Aug 17 2014 04:28:17 GMT-0700 (PDT),Repellat eos voluptatem deleniti laudantium atque eaque ipsa laudantium quidem.,20,false
80,32,http://lorempixel.com/640/480/food,Wed Dec 10 2014 06:36:51 GMT-0800 (PST),Maiores tenetur neque nihil voluptatem ut dignissimos et fuga dolorem.,34,false
29,14,http://lorempixel.com/640/480/food,Wed Sep 24 2014 10:26:16 GMT-0700 (PDT),Repudiandae est quae officiis magnam esse nam et voluptatem impedit.,34,false
80,9,http://lorempixel.com/640/480/food,Tue Jan 02 2018 05:27:09 GMT-0800 (PST),Dolor autem officiis dolorem tempore voluptas ea magni excepturi non.,26,false
57,9,http://lorempixel.com/640/480/food,Fri Mar 03 2017 17:45:40 GMT-0800 (PST),Deleniti odio dicta est hic autem alias autem ut eligendi.,1,false
58,43,http://lorempixel.com/640/480/food,Sun Nov 01 2015 04:48:56 GMT-0800 (PST),Et libero laborum voluptas autem praesentium laborum quia est maxime.,27,false
69,24,http://lorempixel.com/640/480/food,Sat Jun 17 2017 01:24:57 GMT-0700 (PDT),Quam id officia quia non ea dolorem quasi laboriosam dicta.,49,false
37,33,http://lorempixel.com/640/480/food,Mon Jan 09 2017 05:25:44 GMT-0800 (PST),Blanditiis maxime consequuntur officia sit facilis tenetur minus repudiandae sequi.,37,false
43,3,http://lorempixel.com/640/480/food,Sun Mar 25 2018 17:29:27 GMT-0700 (PDT),Eligendi ducimus iure id sed laborum et voluptatem accusantium et.,0,false
50,14,http://lorempixel.com/640/480/food,Wed Nov 18 2015 19:41:11 GMT-0800 (PST),Necessitatibus laboriosam aspernatur sed neque soluta non voluptatem et eos.,27,false
98,0,http://lorempixel.com/640/480/food,Thu Feb 02 2017 14:58:06 GMT-0800 (PST),Et est sed voluptatem rerum iste aliquam qui rerum nesciunt.,48,false
26,20,http://lorempixel.com/640/480/food,Mon Oct 17 2016 06:45:55 GMT-0700 (PDT),Velit sed saepe iusto similique ad placeat sapiente quam cumque.,50,false
53,23,http://lorempixel.com/640/480/food,Thu Dec 28 2017 16:35:38 GMT-0800 (PST),Dolor ad est illo quos recusandae quis ut ut cupiditate.,23,false
92,45,http://lorempixel.com/640/480/food,Thu Aug 07 2014 17:40:30 GMT-0700 (PDT),Quos consequatur voluptatem deleniti eos voluptate corrupti optio libero et.,10,false
29,1,http://lorempixel.com/640/480/food,Sat Dec 10 2016 00:42:23 GMT-0800 (PST),Delectus voluptates voluptatem atque tempore debitis vero pariatur ducimus impedit.,29,false
2,18,http://lorempixel.com/640/480/food,Thu Mar 26 2015 11:50:43 GMT-0700 (PDT),Aut voluptatem atque voluptatem laudantium omnis maiores rem provident aut.,48,false
3,40,http://lorempixel.com/640/480/food,Thu Sep 06 2018 16:02:09 GMT-0700 (PDT),Alias hic eius itaque ratione ea incidunt ducimus optio rerum.,18,false
44,9,http://lorempixel.com/640/480/food,Sun Sep 02 2018 22:44:34 GMT-0700 (PDT),Sapiente a omnis aut mollitia itaque ut eos rerum culpa.,45,false
58,43,http://lorempixel.com/640/480/food,Tue Oct 08 2013 04:31:10 GMT-0700 (PDT),Nam praesentium sit voluptatem vitae ut nesciunt itaque soluta voluptas.,30,false
9,32,http://lorempixel.com/640/480/food,Sat Jul 26 2014 17:18:07 GMT-0700 (PDT),Reiciendis quia earum tenetur quaerat tempora molestiae ducimus nobis iste.,34,false
12,23,http://lorempixel.com/640/480/food,Fri May 09 2014 01:15:40 GMT-0700 (PDT),Dignissimos ea odit sed quo aut sit iure accusantium aliquam.,42,false
54,35,http://lorempixel.com/640/480/food,Sun Oct 27 2013 21:39:29 GMT-0700 (PDT),Nobis minus exercitationem vel at ut et repudiandae repellendus nemo.,27,false
28,27,http://lorempixel.com/640/480/food,Fri Nov 17 2017 21:19:59 GMT-0800 (PST),Quibusdam nisi dicta nulla a rem debitis consequatur laudantium magni.,44,false
17,18,http://lorempixel.com/640/480/food,Mon Aug 06 2018 03:57:58 GMT-0700 (PDT),Et asperiores harum quidem quibusdam quisquam sint et commodi cumque.,0,false
59,50,http://lorempixel.com/640/480/food,Fri Apr 28 2017 17:51:48 GMT-0700 (PDT),Et quas et esse perferendis et quos molestias vero voluptas.,36,false
89,9,http://lorempixel.com/640/480/food,Tue Oct 14 2014 19:45:06 GMT-0700 (PDT),Doloremque soluta cumque voluptatem in eligendi illo sit nam qui.,44,false
13,41,http://lorempixel.com/640/480/food,Wed Sep 05 2018 06:05:57 GMT-0700 (PDT),Magnam officia amet commodi amet voluptates officia nihil corrupti quasi.,35,false
94,44,http://lorempixel.com/640/480/food,Sun Mar 23 2014 23:56:14 GMT-0700 (PDT),Fugiat sint quam omnis quo qui explicabo dolores explicabo molestias.,6,false
92,2,http://lorempixel.com/640/480/food,Thu Jul 06 2017 14:12:28 GMT-0700 (PDT),Laboriosam sit quisquam iusto rem quia qui sed mollitia inventore.,13,false
57,35,http://lorempixel.com/640/480/food,Mon Jan 30 2017 23:30:28 GMT-0800 (PST),Animi consequatur qui voluptas asperiores pariatur velit iure et aut.,14,false
99,16,http://lorempixel.com/640/480/food,Wed Dec 07 2016 07:59:00 GMT-0800 (PST),Neque alias impedit commodi velit totam dolores harum reprehenderit rerum.,48,false
97,27,http://lorempixel.com/640/480/food,Wed Dec 31 2014 06:47:58 GMT-0800 (PST),Voluptatem consequatur rerum et qui adipisci perspiciatis sunt debitis et.,43,false
6,11,http://lorempixel.com/640/480/food,Sun Nov 15 2015 22:17:11 GMT-0800 (PST),Quisquam doloribus itaque adipisci perferendis expedita nisi sequi ut consequuntur.,34,false
83,29,http://lorempixel.com/640/480/food,Sun Oct 04 2015 21:01:53 GMT-0700 (PDT),Ducimus alias placeat fugiat nisi voluptates a maiores enim temporibus.,19,false
20,19,http://lorempixel.com/640/480/food,Sun Jun 01 2014 09:48:29 GMT-0700 (PDT),Ipsum veniam quod ut cupiditate veritatis vel ipsam nemo voluptatem.,49,false
26,3,http://lorempixel.com/640/480/food,Tue Jul 28 2015 14:59:36 GMT-0700 (PDT),Modi molestias non iste et occaecati commodi excepturi quia nulla.,38,false
53,2,http://lorempixel.com/640/480/food,Sun Sep 17 2017 10:18:12 GMT-0700 (PDT),Enim assumenda repellendus dicta officiis pariatur doloremque quaerat dolores incidunt.,45,false
62,32,http://lorempixel.com/640/480/food,Wed Feb 10 2016 04:09:46 GMT-0800 (PST),Repellat est amet officiis doloribus cum perferendis voluptas asperiores voluptas.,25,false
26,14,http://lorempixel.com/640/480/food,Thu Aug 17 2017 23:59:13 GMT-0700 (PDT),Nesciunt modi iusto accusantium omnis quo quae asperiores non provident.,36,false
97,30,http://lorempixel.com/640/480/food,Sun Aug 09 2015 09:42:55 GMT-0700 (PDT),Explicabo autem cum et saepe possimus impedit omnis itaque explicabo.,40,false
0,17,http://lorempixel.com/640/480/food,Fri Jun 22 2018 07:27:29 GMT-0700 (PDT),Qui nisi doloribus delectus inventore fugiat soluta eos commodi similique.,22,false
57,26,http://lorempixel.com/640/480/food,Sun Nov 01 2015 16:57:30 GMT-0800 (PST),Molestiae voluptatem nemo suscipit reprehenderit omnis consequatur magnam et distinctio.,35,false
29,39,http://lorempixel.com/640/480/food,Fri Jan 12 2018 08:55:20 GMT-0800 (PST),Deleniti fugiat maiores autem eligendi aut dolores possimus molestiae possimus.,7,false
0,2,http://lorempixel.com/640/480/food,Sun Sep 29 2013 02:12:02 GMT-0700 (PDT),Ipsa aliquam sunt id ipsum magni ipsum est optio facilis.,40,false
66,35,http://lorempixel.com/640/480/food,Thu Feb 20 2014 13:58:11 GMT-0800 (PST),Eos tempora vitae odio enim a omnis autem iure omnis.,35,false
37,40,http://lorempixel.com/640/480/food,Tue Jun 24 2014 11:30:40 GMT-0700 (PDT),Quos vel qui et fugiat et omnis nostrum ut facilis.,50,false
99,12,http://lorempixel.com/640/480/food,Sat Oct 03 2015 12:58:27 GMT-0700 (PDT),Iure debitis et sit possimus autem esse tempore consectetur facilis.,38,false
10,25,http://lorempixel.com/640/480/food,Tue Aug 08 2017 01:48:39 GMT-0700 (PDT),Nesciunt omnis corrupti eligendi possimus facere et nulla reiciendis magni.,22,false
37,35,http://lorempixel.com/640/480/food,Mon Dec 23 2013 19:26:59 GMT-0800 (PST),Quo iste amet dignissimos possimus ullam aut temporibus quia voluptatem.,0,false
6,24,http://lorempixel.com/640/480/food,Fri Mar 23 2018 20:50:15 GMT-0700 (PDT),Aut praesentium at libero aut maxime corporis nemo nesciunt esse.,47,false
73,12,http://lorempixel.com/640/480/food,Mon Oct 06 2014 17:06:22 GMT-0700 (PDT),Eos vero incidunt impedit velit officia numquam et aut rerum.,30,false
74,5,http://lorempixel.com/640/480/food,Sat Apr 15 2017 04:35:42 GMT-0700 (PDT),Quidem ea laboriosam aliquam sed dolores quia occaecati fuga error.,31,false
37,17,http://lorempixel.com/640/480/food,Wed Aug 13 2014 16:05:37 GMT-0700 (PDT),Nesciunt nihil aspernatur eveniet omnis maiores molestiae a minus voluptate.,8,false
62,16,http://lorempixel.com/640/480/food,Sun Oct 25 2015 21:11:11 GMT-0700 (PDT),Magni in et nobis rerum nisi blanditiis voluptatum dolores sapiente.,23,false
74,37,http://lorempixel.com/640/480/food,Sat May 24 2014 04:41:13 GMT-0700 (PDT),Error quidem commodi consequatur enim iusto non reiciendis minus illum.,8,false
62,36,http://lorempixel.com/640/480/food,Tue Feb 27 2018 23:51:41 GMT-0800 (PST),Nemo libero nihil eaque qui rerum optio similique doloremque magni.,1,false
70,21,http://lorempixel.com/640/480/food,Fri Jul 11 2014 09:41:47 GMT-0700 (PDT),Quo veritatis qui est est ut excepturi odio reprehenderit et.,50,false
8,31,http://lorempixel.com/640/480/food,Mon May 28 2018 03:19:27 GMT-0700 (PDT),Et blanditiis similique temporibus quis voluptas error accusantium aut labore.,34,false
23,47,http://lorempixel.com/640/480/food,Sun Feb 19 2017 08:53:21 GMT-0800 (PST),Ut sequi repudiandae officiis officia ullam numquam qui perferendis sed.,23,false
49,17,http://lorempixel.com/640/480/food,Sat Nov 22 2014 20:48:13 GMT-0800 (PST),Omnis autem voluptas qui qui est non sit est autem.,2,false
21,35,http://lorempixel.com/640/480/food,Mon Jan 02 2017 16:59:06 GMT-0800 (PST),Ea repudiandae mollitia temporibus aperiam ullam commodi possimus enim libero.,17,false
88,45,http://lorempixel.com/640/480/food,Thu Apr 16 2015 03:06:23 GMT-0700 (PDT),Omnis necessitatibus hic magni mollitia tenetur a velit ab non.,32,false
32,46,http://lorempixel.com/640/480/food,Sun Aug 02 2015 14:41:38 GMT-0700 (PDT),Tempora odit non dolore totam ut natus distinctio consequuntur ad.,26,false
25,22,http://lorempixel.com/640/480/food,Fri Jul 28 2017 11:46:34 GMT-0700 (PDT),Quae quis nisi non aut exercitationem aliquid tempora eum cumque.,46,false
50,37,http://lorempixel.com/640/480/food,Tue Aug 26 2014 11:29:38 GMT-0700 (PDT),Omnis rem ab earum provident quibusdam laudantium iste non voluptates.,46,false
39,1,http://lorempixel.com/640/480/food,Fri Feb 17 2017 06:27:39 GMT-0800 (PST),Corrupti sit molestias unde est facere animi deleniti quia numquam.,24,false
97,48,http://lorempixel.com/640/480/food,Fri Feb 06 2015 09:48:33 GMT-0800 (PST),Velit quia qui velit voluptatibus placeat repellat architecto commodi ut.,1,false
9,32,http://lorempixel.com/640/480/food,Mon Dec 26 2016 13:26:51 GMT-0800 (PST),Fugit in repellat aut quia accusamus praesentium occaecati eum ea.,33,false
4,2,http://lorempixel.com/640/480/food,Wed Feb 14 2018 20:54:02 GMT-0800 (PST),Et est qui culpa corporis reprehenderit adipisci eum sit ea.,41,false
83,38,http://lorempixel.com/640/480/food,Thu May 08 2014 16:53:09 GMT-0700 (PDT),Est sit quasi ut sit quia alias dicta nostrum vitae.,43,false
52,26,http://lorempixel.com/640/480/food,Thu Apr 03 2014 20:11:09 GMT-0700 (PDT),Voluptas esse dignissimos eum minima fugit qui culpa inventore ducimus.,21,false
16,25,http://lorempixel.com/640/480/food,Sat Jun 25 2016 11:33:16 GMT-0700 (PDT),Odio ullam vel odio magni est et iusto voluptatum culpa.,9,false
47,50,http://lorempixel.com/640/480/food,Sat Sep 02 2017 08:20:09 GMT-0700 (PDT),Reprehenderit rerum enim et quia est soluta nobis harum est.,5,false
100,43,http://lorempixel.com/640/480/food,Fri Jun 05 2015 03:47:34 GMT-0700 (PDT),Rerum aperiam quia nihil omnis et ut rerum quia at.,34,false
66,6,http://lorempixel.com/640/480/food,Fri Feb 16 2018 17:21:48 GMT-0800 (PST),Non perspiciatis soluta velit similique soluta optio quia sint earum.,26,false
50,27,http://lorempixel.com/640/480/food,Mon Jul 23 2018 18:34:38 GMT-0700 (PDT),Unde quia soluta aut non molestiae dolores aut id et.,21,false
33,35,http://lorempixel.com/640/480/food,Wed Nov 20 2013 07:56:17 GMT-0800 (PST),Distinctio placeat aut quod sunt culpa vel amet voluptates nisi.,17,false
54,40,http://lorempixel.com/640/480/food,Mon Nov 10 2014 12:33:52 GMT-0800 (PST),Assumenda numquam assumenda quo ratione velit illo asperiores et error.,22,false
23,28,http://lorempixel.com/640/480/food,Thu Apr 02 2015 02:40:18 GMT-0700 (PDT),Et perspiciatis porro alias voluptatem corporis cumque exercitationem beatae consectetur.,1,false
83,41,http://lorempixel.com/640/480/food,Fri Sep 02 2016 05:07:58 GMT-0700 (PDT),Accusantium placeat ducimus sit est labore reiciendis alias ut impedit.,45,false
40,3,http://lorempixel.com/640/480/food,Wed Nov 05 2014 19:52:00 GMT-0800 (PST),Reprehenderit placeat vero qui nihil delectus ut sint ad facere.,40,false
51,1,http://lorempixel.com/640/480/food,Wed May 10 2017 05:30:02 GMT-0700 (PDT),Totam aliquam aperiam iste iure illo adipisci qui doloremque sequi.,2,false
